reviewId,userName,userImage,content,score,thumbsUpCount,reviewCreatedVersion,at,replyContent,repliedAt,appVersion
27af7436-7de1-406b-91f4-754ee9afbf71,A Google user,https://play-lh.googleusercontent.com/EGemoI2NTXmTsBVtJqk8jxF9rh8ApRWfsIMQSt2uE4OcpQqbFu7f7NbTK05lx80nuSijCz7sc3a277R67g,sweet,5,0,4.79.2,2025-07-28 18:51:13,"Hey there, thank you for the perfect ratings. We appreciate your efforts in contributing to our improvements.",2025-07-28 18:52:33,4.79.2
1d379f27-3335-4d88-9c99-9abde326db3b,A Google user,https://play-lh.googleusercontent.com/EGemoI2NTXmTsBVtJqk8jxF9rh8ApRWfsIMQSt2uE4OcpQqbFu7f7NbTK05lx80nuSijCz7sc3a277R67g,wonderful 👍😊,4,0,4.85.1,2025-07-28 18:48:42,"Hi, thank you for delighting us with the positive review. We request you to let us know more about your experience by writing an email to swiggysocial@swiggy.in so we can make our service worth 5 stars.",2025-07-28 18:52:34,4.85.1
ea071eaf-8ce5-4fad-9fdd-479875201c67,A Google user,https://play-lh.googleusercontent.com/EGemoI2NTXmTsBVtJqk8jxF9rh8ApRWfsIMQSt2uE4OcpQqbFu7f7NbTK05lx80nuSijCz7sc3a277R67g,"default, ashirwad atta is opened or damaged packet I got",1,0,4.84.2,2025-07-28 18:47:48,"Hey there, we are sorry to have put you through such a situation. We would like to make amends and request you to kindly share the order ID along with the details of your concern at swiggysocial@swiggy.in and we will do what it takes to turn this around!",2025-07-28 18:52:33,4.84.2
bd3a05b8-8e27-4d98-9424-cd6a9827017b,A Google user,https://play-lh.googleusercontent.com/EGemoI2NTXmTsBVtJqk8jxF9rh8ApRWfsIMQSt2uE4OcpQqbFu7f7NbTK05lx80nuSijCz7sc3a277R67g,"I think Swiggy is playing with people's health and should be investigated by health authorities. I bought an ash gourd, which usually stays fresh for 5 to 6 months after being plucked. However, the ash gourd I received from Swiggy was fine upon delivery but got rotten within just 5 days. It's clear that Swiggy is doing something questionable.",1,0,,2025-07-28 18:46:44,"Hi, we are sorry about the below-par experience with your order. Please write to us at swiggysocial@swiggy.in along with the order ID, so we can assist you better.",2025-07-28 18:52:33,
1f7d44d4-31cd-4eb0-99ab-918394f0e41b,A Google user,https://play-lh.googleusercontent.com/EGemoI2NTXmTsBVtJqk8jxF9rh8ApRWfsIMQSt2uE4OcpQqbFu7f7NbTK05lx80nuSijCz7sc3a277R67g,good,5,0,4.84.2,2025-07-28 18:46:18,Hey there! Such positive reviews motivate us to strive hard to provide you a much better experience. Happy ordering. 🙂,2025-07-28 18:52:32,4.84.2
5782a7f3-7b83-4fd8-a0bf-f808855fb6a8,A Google user,https://play-lh.googleusercontent.com/EGemoI2NTXmTsBVtJqk8jxF9rh8ApRWfsIMQSt2uE4OcpQqbFu7f7NbTK05lx80nuSijCz7sc3a277R67g,good,4,0,4.80.2,2025-07-28 18:44:42,"Hello, thank you so much for the positive review! We'll endeavor to keep it up. Please let us know how we can provide service worth 5 stars by writing to us at swiggysocial@swiggy.in from your registered email address.",2025-07-28 18:52:33,4.80.2
bd1a03ca-197d-4744-8b97-3ba2ee787182,A Google user,https://play-lh.googleusercontent.com/EGemoI2NTXmTsBVtJqk8jxF9rh8ApRWfsIMQSt2uE4OcpQqbFu7f7NbTK05lx80nuSijCz7sc3a277R67g,very delicious food and fantastic app of swiggy,5,0,4.84.2,2025-07-28 18:42:51,Hey there! Such positive reviews motivate us to strive hard to provide you a much better experience. Happy ordering. 🙂,2025-07-28 18:52:34,4.84.2
a7f0e1ee-9942-4935-859f-64dcd93bc973,A Google user,https://play-lh.googleusercontent.com/EGemoI2NTXmTsBVtJqk8jxF9rh8ApRWfsIMQSt2uE4OcpQqbFu7f7NbTK05lx80nuSijCz7sc3a277R67g,nice,4,0,4.84.2,2025-07-28 18:38:01,"Hi, thank you for delighting us with the positive review. We request you to let us know more about your experience by writing an email to swiggysocial@swiggy.in so we can make our service worth 5 stars.",2025-07-28 18:42:24,4.84.2
78c1ac07-f515-4ff1-afa3-86d9abad6828,A Google user,https://play-lh.googleusercontent.com/EGemoI2NTXmTsBVtJqk8jxF9rh8ApRWfsIMQSt2uE4OcpQqbFu7f7NbTK05lx80nuSijCz7sc3a277R67g,good,5,0,4.84.2,2025-07-28 18:37:42,"Hey, thanks for the rating! This motivates us to keep serving you better with every order.",2025-07-28 18:42:25,4.84.2
5f018e62-fb74-438d-a367-83bc4f19f538,A Google user,https://play-lh.googleusercontent.com/EGemoI2NTXmTsBVtJqk8jxF9rh8ApRWfsIMQSt2uE4OcpQqbFu7f7NbTK05lx80nuSijCz7sc3a277R67g,super,5,0,4.84.2,2025-07-28 18:37:09,Hey there! It's a bliss to see that our service brought a smile to your face. We'll endeavor to keep it up. Keep Swiggying. 🙂,2025-07-28 18:42:25,4.84.2
35753c2c-59a3-4856-8fcb-23dfd01eaeb2,A Google user,https://play-lh.googleusercontent.com/EGemoI2NTXmTsBVtJqk8jxF9rh8ApRWfsIMQSt2uE4OcpQqbFu7f7NbTK05lx80nuSijCz7sc3a277R67g,worst customer service.,1,0,4.81.3,2025-07-28 18:34:21,"We're apologetic about this experience you've faced while ordering with us. Please write to us at swiggysocial@swiggy.in from your registered email address detailing your experience, so we can look into the issue and resolve it for you.",2025-07-28 18:42:25,4.81.3
d99b69dd-f542-498a-a222-484e41d678a6,A Google user,https://play-lh.googleusercontent.com/EGemoI2NTXmTsBVtJqk8jxF9rh8ApRWfsIMQSt2uE4OcpQqbFu7f7NbTK05lx80nuSijCz7sc3a277R67g,best,5,0,4.84.2,2025-07-28 18:34:07,"Hey there, thank you for the perfect ratings. We appreciate your efforts in contributing to our improvements.",2025-07-28 18:42:25,4.84.2
9ce75ce0-bd32-4b78-a042-3c1c5c7f6b07,A Google user,https://play-lh.googleusercontent.com/EGemoI2NTXmTsBVtJqk8jxF9rh8ApRWfsIMQSt2uE4OcpQqbFu7f7NbTK05lx80nuSijCz7sc3a277R67g,doesn't gives us good offers,1,0,4.84.2,2025-07-28 18:29:21,"Hi, we are sorry about the below-par experience with your order. Please write to us at swiggysocial@swiggy.in along with the order ID, so we can assist you better.",2025-07-28 18:32:33,4.84.2
243a286e-990c-4158-bfd2-5acc72a38703,A Google user,https://play-lh.googleusercontent.com/EGemoI2NTXmTsBVtJqk8jxF9rh8ApRWfsIMQSt2uE4OcpQqbFu7f7NbTK05lx80nuSijCz7sc3a277R67g,gambler automatic added tips and highest delivery charges. Shame on you.,1,0,4.84.2,2025-07-28 18:16:18,"Hi there, we understand you want more clarity on our delivery charges. Please share your registered details or the order ID by writing to us at swiggysocial@swiggy.in and we would be happy to connect with you post having it checked",2025-07-28 18:22:26,4.84.2
be80013d-765d-44d9-9ea1-66cb383b1965,A Google user,https://play-lh.googleusercontent.com/EGemoI2NTXmTsBVtJqk8jxF9rh8ApRWfsIMQSt2uE4OcpQqbFu7f7NbTK05lx80nuSijCz7sc3a277R67g,best,5,0,4.84.2,2025-07-28 18:16:10,"Hi there, thank you for your patronage and the perfect rating. We will strive to provide consistent seamless ordering experiences. Keep Swiggying!",2025-07-28 18:22:26,4.84.2
153c8f1b-25bd-49e5-8095-e10a5226be47,A Google user,https://play-lh.googleusercontent.com/EGemoI2NTXmTsBVtJqk8jxF9rh8ApRWfsIMQSt2uE4OcpQqbFu7f7NbTK05lx80nuSijCz7sc3a277R67g,best app,5,0,,2025-07-28 18:12:00,Yay! We are super happy to know that you are enjoying our services. Thanks for taking the time out and sharing the review with a perfect star rating. Keep Ordering. 🙂,2025-07-28 18:12:35,
fe32c981-0192-43fe-8834-8da5f3ca0dcb,A Google user,https://play-lh.googleusercontent.com/EGemoI2NTXmTsBVtJqk8jxF9rh8ApRWfsIMQSt2uE4OcpQqbFu7f7NbTK05lx80nuSijCz7sc3a277R67g,👍,3,0,,2025-07-28 18:06:23,"We extend our gratitude for reviewing us. However, we do understand that there is room for improvement to achieve a 5-star from you. We look forward to hearing from you via mail addressed to swiggysocial@swiggy.in from your registered email address.",2025-07-28 18:12:35,
dd5b2190-4fae-4988-81d1-60cdb5b71128,A Google user,https://play-lh.googleusercontent.com/EGemoI2NTXmTsBVtJqk8jxF9rh8ApRWfsIMQSt2uE4OcpQqbFu7f7NbTK05lx80nuSijCz7sc3a277R67g,good app with fast delivery and good quality food,5,0,4.84.2,2025-07-28 18:00:03,Hey there! It's a bliss to see that our service brought a smile to your face. We'll endeavor to keep it up. Keep Swiggying. 🙂,2025-07-28 18:02:43,4.84.2
82a97886-f5b0-4a27-8397-eee6102b9c9c,A Google user,https://play-lh.googleusercontent.com/EGemoI2NTXmTsBVtJqk8jxF9rh8ApRWfsIMQSt2uE4OcpQqbFu7f7NbTK05lx80nuSijCz7sc3a277R67g,best apps for food,5,0,4.85.1,2025-07-28 17:59:42,Yay! We are super happy to know that you are enjoying our services. Thanks for taking the time out and sharing the review with a perfect star rating. Keep Ordering. 🙂,2025-07-28 18:02:43,4.85.1
2f790b66-a5a2-4a7b-9331-44a81d1dccf4,A Google user,https://play-lh.googleusercontent.com/EGemoI2NTXmTsBVtJqk8jxF9rh8ApRWfsIMQSt2uE4OcpQqbFu7f7NbTK05lx80nuSijCz7sc3a277R67g,cannot solve the queries and cannot generate refund if order is wrong or missing always say that you should contact the restaurants,2,0,4.85.1,2025-07-28 17:58:04,"Hi, we are sorry about the ordeal. Please write to us at swiggysocial@swiggy.in along with the order ID, so we can assist you better.",2025-07-28 18:02:44,4.85.1
34bfb54a-ea56-4de9-a882-815a817ab244,A Google user,https://play-lh.googleusercontent.com/EGemoI2NTXmTsBVtJqk8jxF9rh8ApRWfsIMQSt2uE4OcpQqbFu7f7NbTK05lx80nuSijCz7sc3a277R67g,good,5,0,4.84.2,2025-07-28 17:55:36,"Hey there, thank you for the perfect ratings. We appreciate your efforts in contributing to our improvements.",2025-07-28 18:02:44,4.84.2
2b366ca1-81af-4fd0-b713-f376eb69230c,A Google user,https://play-lh.googleusercontent.com/EGemoI2NTXmTsBVtJqk8jxF9rh8ApRWfsIMQSt2uE4OcpQqbFu7f7NbTK05lx80nuSijCz7sc3a277R67g,love it,5,0,4.84.2,2025-07-28 17:55:03,"Hey there, nothing delights us more than hearing this. We are happy that you had a great experience. Keep Swiggying. 🙂",2025-07-28 18:02:42,4.84.2
1ff12d3f-6c4b-4a60-82e9-8bb39f74dc49,A Google user,https://play-lh.googleusercontent.com/EGemoI2NTXmTsBVtJqk8jxF9rh8ApRWfsIMQSt2uE4OcpQqbFu7f7NbTK05lx80nuSijCz7sc3a277R67g,"the period is too long and they keeps changing time , even the clock times their time doesn't move. very bad experience",1,0,,2025-07-28 17:54:33,"Hey there, we are sorry to have put you through such a situation. We would like to make amends and request you to kindly share the order ID along with the details of your concern at swiggysocial@swiggy.in and we will do what it takes to turn this around!",2025-07-28 18:02:44,
752fd78a-1959-4e4a-8cae-3438563c6b92,A Google user,https://play-lh.googleusercontent.com/EGemoI2NTXmTsBVtJqk8jxF9rh8ApRWfsIMQSt2uE4OcpQqbFu7f7NbTK05lx80nuSijCz7sc3a277R67g,my friend is also there so I give you a 4star,4,0,4.84.2,2025-07-28 17:53:56,Hey there! Such a bliss! We request you to let us know more about your experience by writing an email to swiggysocial@swiggy.in so we can make our services better.,2025-07-28 18:02:43,4.84.2
034c0cdd-10fa-4d19-98a7-f5eae965e505,A Google user,https://play-lh.googleusercontent.com/EGemoI2NTXmTsBVtJqk8jxF9rh8ApRWfsIMQSt2uE4OcpQqbFu7f7NbTK05lx80nuSijCz7sc3a277R67g,so nice 👍,5,0,4.85.1,2025-07-28 17:47:55,"Hey, we are glad to have patrons like you and will strive towards providing better services to keep such reviews coming our way. Keep ordering.",2025-07-28 17:52:32,4.85.1
8ab25912-59d4-49b6-91af-6322bf4da9c9,A Google user,https://play-lh.googleusercontent.com/EGemoI2NTXmTsBVtJqk8jxF9rh8ApRWfsIMQSt2uE4OcpQqbFu7f7NbTK05lx80nuSijCz7sc3a277R67g,order not received after waiting 1.5 hour very bad service,1,0,,2025-07-28 17:34:27,"Hello, we're sorry for the unpleasant experience. Please share your concern along with your order details via email at swiggysocial@swiggy.in so that we will look into this & assist you better.",2025-07-28 17:42:25,
b2492c3a-931c-4931-9718-c35806459218,A Google user,https://play-lh.googleusercontent.com/EGemoI2NTXmTsBVtJqk8jxF9rh8ApRWfsIMQSt2uE4OcpQqbFu7f7NbTK05lx80nuSijCz7sc3a277R67g,excellent mind-blowing very helpful aap,5,0,4.85.1,2025-07-28 17:33:39,Hey there! Such positive reviews motivate us to strive hard to provide you a much better experience. Happy ordering. 🙂,2025-07-28 17:42:26,4.85.1
68091b9c-4cee-48f4-9661-d8cf74d77de2,A Google user,https://play-lh.googleusercontent.com/EGemoI2NTXmTsBVtJqk8jxF9rh8ApRWfsIMQSt2uE4OcpQqbFu7f7NbTK05lx80nuSijCz7sc3a277R67g,nice,5,0,4.85.1,2025-07-28 17:28:36,Hey there! Such positive reviews motivate us to strive hard to provide you a much better experience. Happy ordering. 🙂,2025-07-28 17:32:27,4.85.1
3b3e2a31-527c-44ac-9c19-8e0616c935ca,A Google user,https://play-lh.googleusercontent.com/EGemoI2NTXmTsBVtJqk8jxF9rh8ApRWfsIMQSt2uE4OcpQqbFu7f7NbTK05lx80nuSijCz7sc3a277R67g,"Out of 5 orders, you will find compain in one order, like expiry date products, but why did I gave 4 Star, because integrity of founder is good as they listen and refund the amount, But ultimately it is the responsibility of founder to ensure that all fresh and good quality products only be delivered to customers as no customer is placing the order for refund, it is time consuming to complain and chat online. And the main reason of ordering online is short of time.",4,0,4.84.2,2025-07-28 17:23:36,"Hey there, thank you. Please let us know how we can make our service worth 5 stars by writing to us at swiggysocial@swiggy.in from your registered email address.",2025-07-28 17:32:28,4.84.2
fc187f9d-e36b-4908-9286-f601b416b72c,A Google user,https://play-lh.googleusercontent.com/EGemoI2NTXmTsBVtJqk8jxF9rh8ApRWfsIMQSt2uE4OcpQqbFu7f7NbTK05lx80nuSijCz7sc3a277R67g,Good,5,0,4.84.2,2025-07-28 17:22:14,"Hey Rohit, nothing delights us more than hearing this. We are happy that you had a great experience. Keep Swiggying. 🙂

^ Sohom",2025-07-28 18:33:31,4.84.2
1f51a41a-c585-44c2-9aae-7ec59cc0a288,A Google user,https://play-lh.googleusercontent.com/EGemoI2NTXmTsBVtJqk8jxF9rh8ApRWfsIMQSt2uE4OcpQqbFu7f7NbTK05lx80nuSijCz7sc3a277R67g,good 👍,5,0,4.83.4,2025-07-28 17:22:12,Hey there! It's a bliss to see that our service brought a smile to your face. We'll endeavor to keep it up. Keep Swiggying. 🙂,2025-07-28 17:32:27,4.83.4
f6785d3f-56ed-471b-92a9-c1c870fb1fce,A Google user,https://play-lh.googleusercontent.com/EGemoI2NTXmTsBVtJqk8jxF9rh8ApRWfsIMQSt2uE4OcpQqbFu7f7NbTK05lx80nuSijCz7sc3a277R67g,good 😊,5,0,4.84.2,2025-07-28 17:14:49,"Hey, thanks for the rating! This motivates us to keep serving you better with every order.",2025-07-28 17:22:22,4.84.2
3d4699ee-bc3e-4aba-acb2-0e71ac9ef6b3,A Google user,https://play-lh.googleusercontent.com/EGemoI2NTXmTsBVtJqk8jxF9rh8ApRWfsIMQSt2uE4OcpQqbFu7f7NbTK05lx80nuSijCz7sc3a277R67g,"very worst service Restaurant bill Rs 522, But Swiggy charged me Rs 624",1,0,4.79.2,2025-07-28 17:13:09,"Hey there, we are sorry to have put you through such a situation. We would like to make amends and request you to kindly share the order ID along with the details of your concern at swiggysocial@swiggy.in and we will do what it takes to turn this around!",2025-07-28 17:22:22,4.79.2
fe393023-b8bd-4dd2-8d23-725aa67b0b5a,A Google user,https://play-lh.googleusercontent.com/EGemoI2NTXmTsBVtJqk8jxF9rh8ApRWfsIMQSt2uE4OcpQqbFu7f7NbTK05lx80nuSijCz7sc3a277R67g,👍,5,0,4.78.2,2025-07-28 17:10:33,"Hey, thanks for the rating! This motivates us to keep serving you better with every order.",2025-07-28 17:12:28,4.78.2
1f8a82af-00f6-4d42-ace6-b6015291fa43,A Google user,https://play-lh.googleusercontent.com/EGemoI2NTXmTsBVtJqk8jxF9rh8ApRWfsIMQSt2uE4OcpQqbFu7f7NbTK05lx80nuSijCz7sc3a277R67g,good service,5,0,4.77.3,2025-07-28 17:04:28,"Hey there, thank you for the perfect ratings. We appreciate your efforts in contributing to our improvements.",2025-07-28 17:12:28,4.77.3
585fda4d-d71b-47c9-aa7a-1b6ea3924771,A Google user,https://play-lh.googleusercontent.com/EGemoI2NTXmTsBVtJqk8jxF9rh8ApRWfsIMQSt2uE4OcpQqbFu7f7NbTK05lx80nuSijCz7sc3a277R67g,I ordered the item and within seconds I cancelled because of some payment related issue. They took the full order amount as cancellation charge. The restaurant didn't even start to prepare. because only that much time only took to cancel. They should have taken a small amount or atleast half the amount as cancellation charge. But here I'm totally disappointed as they took the whole amount as cancellation charge. We are paying actually double the amount of the real charge in online.,1,0,,2025-07-28 17:03:56,"We're apologetic about this experience you've faced while ordering with us. Please write to us at swiggysocial@swiggy.in from your registered email address detailing your experience, so we can look into the issue and resolve it for you.",2025-07-28 17:12:29,
a9be30ba-4e3d-484b-8fb7-7e3e2f138fb8,A Google user,https://play-lh.googleusercontent.com/EGemoI2NTXmTsBVtJqk8jxF9rh8ApRWfsIMQSt2uE4OcpQqbFu7f7NbTK05lx80nuSijCz7sc3a277R67g,I ws so hungry so I hv ordered food frm Punjab depot (Airoli) and the dal was stale smelling very bad so I hv complained to replace it but in return what I received is that they hv standardized their food so we can't refund or replace... so basically the loss is mine & no one is ready to take the responsibility and simply it's a loss of customers hence I have deleted the app and if u love your health I would suggest not to order from Punjab debot sometimes they serve stale and low quality food,1,0,4.5.0,2025-07-28 17:01:53,We're disappointed to know the service has not been to your satisfaction. Kindly write to us at swiggysocial@swiggy.in from your registered email address and we'll have this addressed.,2025-07-28 17:02:28,4.5.0
201e38aa-5626-4d77-afdc-3631d4f2c8d1,A Google user,https://play-lh.googleusercontent.com/EGemoI2NTXmTsBVtJqk8jxF9rh8ApRWfsIMQSt2uE4OcpQqbFu7f7NbTK05lx80nuSijCz7sc3a277R67g,to much money,1,0,4.84.2,2025-07-28 16:55:16,"Hi, please let us know how we can make our service better by writing to us at swiggysocial@swiggy.in from your registered email address.",2025-07-28 17:02:28,4.84.2
a0582051-3842-4a0d-bca4-3603dfbc2a38,A Google user,https://play-lh.googleusercontent.com/EGemoI2NTXmTsBVtJqk8jxF9rh8ApRWfsIMQSt2uE4OcpQqbFu7f7NbTK05lx80nuSijCz7sc3a277R67g,"What a scam. Bolt order, 20min time guaranted order receives after 1hr15min. Even after 30mins order is not accepted, can't even cancel the order. 3mins countdown started on 4:24 and im still waiting for 3mins to end.",1,0,4.84.2,2025-07-28 16:51:50,"We sincerely apologize for this experience. Please reach out to us at swiggysocial@swiggy.in using your registered email address and provide details about your experience, so we can investigate the matter and address it for you.",2025-07-28 17:12:31,4.84.2
af519e52-5cd6-401c-a354-5d565d4d1974,A Google user,https://play-lh.googleusercontent.com/EGemoI2NTXmTsBVtJqk8jxF9rh8ApRWfsIMQSt2uE4OcpQqbFu7f7NbTK05lx80nuSijCz7sc3a277R67g,good,5,0,4.85.1,2025-07-28 16:51:05,"Hey, thanks for the rating! This motivates us to keep serving you better with every order.",2025-07-28 16:52:47,4.85.1
482a3f74-fdae-4337-be10-f5332292871b,A Google user,https://play-lh.googleusercontent.com/EGemoI2NTXmTsBVtJqk8jxF9rh8ApRWfsIMQSt2uE4OcpQqbFu7f7NbTK05lx80nuSijCz7sc3a277R67g,sabse ghatiya costumer service.dhanki dete h app par koi solution nhi diya to bolte h mail karo mail karne k bad bhi inhone bola 26 hour m apka solution ho jayega. uske bad 8 din ho gye 2-3 bar bol chuka khuch reply nhi karte.isse bakwas costumer service nhi dekhi aaj tak. mene ek order kiya tha uska amount 140 rupay tha lekin UPI se payment failed ho gya or COD par order ho gya or amount automatically 271 ho gya mene turant help m jakar order cancel k liye bola....(baki bat Twitter par daluga,1,0,,2025-07-28 16:46:54,"Hi, please write to us about your experience at swiggysocial@swiggy.in from your registered email address, so we can better our services.",2025-07-28 16:52:47,
3feaab6a-a181-456b-9890-071786fc5af5,A Google user,https://play-lh.googleusercontent.com/EGemoI2NTXmTsBVtJqk8jxF9rh8ApRWfsIMQSt2uE4OcpQqbFu7f7NbTK05lx80nuSijCz7sc3a277R67g,Mere pass saboot hai ki kbhi ispe order na kare aap agar complain krte h ki ye restaurant galat hai to 2 din tak bhuke reh kr bas wait kare ki aap bhighari h tab bhi wait kare iska ki kb 2din baad aapka order aata h ki nhi Zomato isse lakho Guna acha h,1,0,4.84.2,2025-07-28 16:46:42,"Hey there, we are sorry to have put you through such a situation. We would like to make amends and request you to kindly share the order ID along with the details of your concern at swiggysocial@swiggy.in and we will do what it takes to turn this around!",2025-07-28 16:52:47,4.84.2
97a4783f-48f2-4a39-be54-de49917b7f06,A Google user,https://play-lh.googleusercontent.com/EGemoI2NTXmTsBVtJqk8jxF9rh8ApRWfsIMQSt2uE4OcpQqbFu7f7NbTK05lx80nuSijCz7sc3a277R67g,"this is the best platform for food, everything is always on time and with heavy discounts, i saved a lot by using this app, i give it 5 stars and I recommend this app to everyone, Thanks a lot to the developer of Swiggy",5,0,4.84.2,2025-07-28 16:39:31,"Hey, thank you for your kind review. We hope to keep on giving you a consistent service every time. We request you to let us know more about your experience by writing an email to swiggysocial@swiggy.in so we can make our services better.",2025-07-28 16:42:34,4.84.2
fc08fe64-bfd2-4ca8-b82b-a5d37f4c08bc,A Google user,https://play-lh.googleusercontent.com/EGemoI2NTXmTsBVtJqk8jxF9rh8ApRWfsIMQSt2uE4OcpQqbFu7f7NbTK05lx80nuSijCz7sc3a277R67g,good,1,0,4.82.1,2025-07-28 16:39:19,"Hi, please write to us about your experience at swiggysocial@swiggy.in from your registered email address, so we can better our services.",2025-07-28 16:42:35,4.82.1
ef82e1ba-7775-495c-bb48-93d039b4f058,A Google user,https://play-lh.googleusercontent.com/EGemoI2NTXmTsBVtJqk8jxF9rh8ApRWfsIMQSt2uE4OcpQqbFu7f7NbTK05lx80nuSijCz7sc3a277R67g,👍,5,0,4.84.2,2025-07-28 16:26:18,Hey there! Such positive reviews motivate us to strive hard to provide you a much better experience. Happy ordering. 🙂,2025-07-28 16:32:30,4.84.2
4c175d61-5fc2-43cf-b6f0-f8134398ddb9,A Google user,https://play-lh.googleusercontent.com/EGemoI2NTXmTsBVtJqk8jxF9rh8ApRWfsIMQSt2uE4OcpQqbFu7f7NbTK05lx80nuSijCz7sc3a277R67g,best offer new costumer,4,0,4.84.2,2025-07-28 16:22:54,"Hello, thank you so much for the positive review! We'll endeavor to keep it up. Please let us know how we can provide service worth 5 stars by writing to us at swiggysocial@swiggy.in from your registered email address.",2025-07-28 16:32:29,4.84.2
4efcb257-9176-4be4-a94f-822f3a1922f2,A Google user,https://play-lh.googleusercontent.com/EGemoI2NTXmTsBVtJqk8jxF9rh8ApRWfsIMQSt2uE4OcpQqbFu7f7NbTK05lx80nuSijCz7sc3a277R67g,best delivery,5,0,4.85.1,2025-07-28 16:19:35,"Hey, thanks for the rating! This motivates us to keep serving you better with every order.",2025-07-28 16:22:25,4.85.1
2b22526b-4a02-461f-a338-f5e2c665f018,A Google user,https://play-lh.googleusercontent.com/EGemoI2NTXmTsBVtJqk8jxF9rh8ApRWfsIMQSt2uE4OcpQqbFu7f7NbTK05lx80nuSijCz7sc3a277R67g,Good,5,0,4.85.1,2025-07-28 16:14:25,"Hi there, thank you for your patronage and the perfect rating. We will strive to provide consistent seamless ordering experiences. Keep Swiggying!",2025-07-28 16:22:24,4.85.1
f315ec7c-782c-4d40-8f58-c5479d4d146a,A Google user,https://play-lh.googleusercontent.com/EGemoI2NTXmTsBVtJqk8jxF9rh8ApRWfsIMQSt2uE4OcpQqbFu7f7NbTK05lx80nuSijCz7sc3a277R67g,good,5,0,4.84.2,2025-07-28 16:09:21,"Hey, thanks for the rating! This motivates us to keep serving you better with every order.",2025-07-28 16:12:32,4.84.2
a765911b-83c9-4c55-a70d-76d19e12ea09,A Google user,https://play-lh.googleusercontent.com/EGemoI2NTXmTsBVtJqk8jxF9rh8ApRWfsIMQSt2uE4OcpQqbFu7f7NbTK05lx80nuSijCz7sc3a277R67g,❤️🫰😘,5,0,4.84.2,2025-07-28 16:04:34,Hey there! It's a bliss to see that our service brought a smile to your face. We'll endeavor to keep it up. Keep Swiggying. 🙂,2025-07-28 16:12:33,4.84.2
5120d36e-461c-4ee2-a32f-92f1c18db254,A Google user,https://play-lh.googleusercontent.com/EGemoI2NTXmTsBVtJqk8jxF9rh8ApRWfsIMQSt2uE4OcpQqbFu7f7NbTK05lx80nuSijCz7sc3a277R67g,extremely poor customer services waste ..,1,0,4.84.2,2025-07-28 16:03:47,"Hey there, we would like to understand the miss in delivering the order within the promised timeline. Please share your order ID by writing to us at swiggysocial@swiggy.in from your registered email ID to have this checked further.",2025-07-28 16:12:31,4.84.2
aa52499f-9280-4a67-9804-a2e14d1e6b97,A Google user,https://play-lh.googleusercontent.com/EGemoI2NTXmTsBVtJqk8jxF9rh8ApRWfsIMQSt2uE4OcpQqbFu7f7NbTK05lx80nuSijCz7sc3a277R67g,Nice 💯,5,0,4.84.2,2025-07-28 16:03:07,"Hey, we are glad to have patrons like you and will strive towards providing better services to keep such reviews coming our way. Keep ordering.",2025-07-28 16:12:31,4.84.2
c565e554-288a-4b3e-9f56-8221e578e72f,A Google user,https://play-lh.googleusercontent.com/EGemoI2NTXmTsBVtJqk8jxF9rh8ApRWfsIMQSt2uE4OcpQqbFu7f7NbTK05lx80nuSijCz7sc3a277R67g,Good for platform for student.,5,0,4.84.2,2025-07-28 16:02:35,Hey there! It's a bliss to see that our service brought a smile to your face. We'll endeavor to keep it up. Keep Swiggying. 🙂,2025-07-28 16:12:32,4.84.2
5509cc74-3633-41d8-8560-a0cd65f364d4,A Google user,https://play-lh.googleusercontent.com/EGemoI2NTXmTsBVtJqk8jxF9rh8ApRWfsIMQSt2uE4OcpQqbFu7f7NbTK05lx80nuSijCz7sc3a277R67g,pls don't order food this app very worst,1,0,4.84.2,2025-07-28 16:01:05,"Hi, we are sorry about this. Please help us with the order id over an email at swiggysocial@swiggy.in, so we can help resolve the issue.",2025-07-28 16:02:36,4.84.2
b948f533-9902-450b-95bd-b08981b2177b,A Google user,https://play-lh.googleusercontent.com/EGemoI2NTXmTsBVtJqk8jxF9rh8ApRWfsIMQSt2uE4OcpQqbFu7f7NbTK05lx80nuSijCz7sc3a277R67g,good,4,0,4.85.1,2025-07-28 15:59:04,"Hey, thanks for the rating! This motivates us to keep serving you better with every order. We would love to hear from you about how we could hit the 5-star rating. Please do share your thoughts by dropping an email at swiggysocial@swiggy.in.",2025-07-28 16:02:36,4.85.1
