reviewId,userName,userImage,content,score,thumbsUpCount,reviewCreatedVersion,at,replyContent,repliedAt,appVersion
d6443b28-c82a-4bb7-9f7a-5bc17876aac9,A Google user,https://play-lh.googleusercontent.com/EGemoI2NTXmTsBVtJqk8jxF9rh8ApRWfsIMQSt2uE4OcpQqbFu7f7NbTK05lx80nuSijCz7sc3a277R67g,taking more time to deliver 😌😔,3,0,4.86.1,2025-08-09 20:20:29,"Hi, we are disappointed to hear about the trouble we put you through. We would like to look into this and make amends for the hassle. Please do share your registered details by dropping an email at swiggysocial@swiggy.in, we will ensure the quickest resolution.",2025-08-09 20:22:33,4.86.1
4d0737e1-b758-4fb8-82ea-2fd2bf0368f2,A Google user,https://play-lh.googleusercontent.com/EGemoI2NTXmTsBVtJqk8jxF9rh8ApRWfsIMQSt2uE4OcpQqbFu7f7NbTK05lx80nuSijCz7sc3a277R67g,"it's good but slowly the convenience chargers, handling chargers. and gst. it's like getting greedy. after 200 the delivery shud be free and delivery person shud get tips that's the only extra makes sense. stop taking advantage of someone need and urgencies.",4,0,3.73.0,2025-08-09 20:19:28,"Hey there, appreciate your feedback, we give utmost priority to our user's feedback and would request you to share yours on swiggysocial@swiggy.in and we can work towards implementing them to provide better services.",2025-08-09 20:22:32,3.73.0
075d6b13-3d70-4d45-a87a-881a95cd3451,A Google user,https://play-lh.googleusercontent.com/EGemoI2NTXmTsBVtJqk8jxF9rh8ApRWfsIMQSt2uE4OcpQqbFu7f7NbTK05lx80nuSijCz7sc3a277R67g,Had a worst experience with Instamart. The app doesn't even show if the product is unavailable before ordering. Ended up spending two times more in re ordering the product and still did not recieve it. Waste of money and time.,1,0,4.86.1,2025-08-09 20:19:04,That doesn't seem right. Kindly help us with more details of this concern by writing to us at swiggysocial@swiggy.in from your registered email ID and we'll get this checked right away for you.,2025-08-09 20:22:34,4.86.1
de68c3ea-d5b2-4055-b5a8-0e11671a3512,A Google user,https://play-lh.googleusercontent.com/EGemoI2NTXmTsBVtJqk8jxF9rh8ApRWfsIMQSt2uE4OcpQqbFu7f7NbTK05lx80nuSijCz7sc3a277R67g,good👍,5,0,4.86.1,2025-08-09 20:18:20,"Hey there, nothing delights us more than hearing this. We are happy that you had a great experience. Keep Swiggying. 🙂",2025-08-09 20:22:34,4.86.1
290424db-2b44-462d-8e64-c9add875a8df,A Google user,https://play-lh.googleusercontent.com/EGemoI2NTXmTsBVtJqk8jxF9rh8ApRWfsIMQSt2uE4OcpQqbFu7f7NbTK05lx80nuSijCz7sc3a277R67g,good,5,0,4.85.2,2025-08-09 20:16:03,"Hi there, thank you for the excellent rating. This will inspire us to continue delivering exceptional service as we always do.",2025-08-09 20:32:37,4.85.2
c397c94c-5c0d-4d6f-a9bd-ea28da888932,A Google user,https://play-lh.googleusercontent.com/EGemoI2NTXmTsBVtJqk8jxF9rh8ApRWfsIMQSt2uE4OcpQqbFu7f7NbTK05lx80nuSijCz7sc3a277R67g,good,5,0,4.86.1,2025-08-09 20:15:05,"Hi there, thank you for your patronage and the perfect rating. We will strive to provide consistent seamless ordering experiences. Keep Swiggying!",2025-08-09 20:22:33,4.86.1
f80e3e7f-9465-4d96-9c3f-3e86756d22ec,A Google user,https://play-lh.googleusercontent.com/EGemoI2NTXmTsBVtJqk8jxF9rh8ApRWfsIMQSt2uE4OcpQqbFu7f7NbTK05lx80nuSijCz7sc3a277R67g,good 👍,5,0,4.86.1,2025-08-09 20:15:05,Thanks for the ratings. Keep Swiggying. 😊,2025-08-09 20:34:50,4.86.1
65fe6e52-0132-4430-a791-726edd6fccab,A Google user,https://play-lh.googleusercontent.com/EGemoI2NTXmTsBVtJqk8jxF9rh8ApRWfsIMQSt2uE4OcpQqbFu7f7NbTK05lx80nuSijCz7sc3a277R67g,super,5,0,4.86.1,2025-08-09 20:14:33,Hey there! Such positive reviews motivate us to strive hard to provide you a much better experience. Happy ordering. 🙂,2025-08-09 20:22:33,4.86.1
7b4e3039-0fd0-4b80-9b45-2bd3cfa060a9,A Google user,https://play-lh.googleusercontent.com/EGemoI2NTXmTsBVtJqk8jxF9rh8ApRWfsIMQSt2uE4OcpQqbFu7f7NbTK05lx80nuSijCz7sc3a277R67g,nice,1,0,4.86.1,2025-08-09 20:14:32,"Hello, we would like to know more about it. Please write to us at swiggysocial@swiggy.in with relevant details elaborating further on your ordering experience with us, so we can set this right for you.",2025-08-09 20:22:31,4.86.1
81c75d5c-86b5-4797-ac0c-0a5032d024a3,A Google user,https://play-lh.googleusercontent.com/EGemoI2NTXmTsBVtJqk8jxF9rh8ApRWfsIMQSt2uE4OcpQqbFu7f7NbTK05lx80nuSijCz7sc3a277R67g,Good in service,5,0,4.86.1,2025-08-09 20:14:21,Hey there! It's a bliss to see that our service brought a smile to your face. We'll endeavor to keep it up. Keep Swiggying. 🙂,2025-08-09 20:22:32,4.86.1
7e1886f4-b925-42e4-8a3b-3eb1998dea0f,A Google user,https://play-lh.googleusercontent.com/EGemoI2NTXmTsBVtJqk8jxF9rh8ApRWfsIMQSt2uE4OcpQqbFu7f7NbTK05lx80nuSijCz7sc3a277R67g,good,5,0,4.86.1,2025-08-09 20:13:22,"Hey, thanks for the rating! This motivates us to keep serving you better with every order.",2025-08-09 20:22:35,4.86.1
125d7a3b-a690-4fcb-950f-025b01b83320,A Google user,https://play-lh.googleusercontent.com/EGemoI2NTXmTsBVtJqk8jxF9rh8ApRWfsIMQSt2uE4OcpQqbFu7f7NbTK05lx80nuSijCz7sc3a277R67g,cool,5,0,4.86.1,2025-08-09 20:12:43,"Hey, thanks for the rating! This motivates us to keep serving you better with every order.",2025-08-09 20:22:33,4.86.1
af17e302-8ba9-4666-b6ba-41002f680dea,A Google user,https://play-lh.googleusercontent.com/EGemoI2NTXmTsBVtJqk8jxF9rh8ApRWfsIMQSt2uE4OcpQqbFu7f7NbTK05lx80nuSijCz7sc3a277R67g,delivery take just too long time,3,0,4.86.1,2025-08-09 20:12:37,"Hi there, thank you for the rating. We sincerely apologize for this experience. Please reach out to us at swiggysocial@swiggy.in using your registered email address and provide details about your experience so we can investigate the matter and address it for you.",2025-08-09 20:31:59,4.86.1
b21183d9-7f31-42ae-8f6d-e1a60c602f86,A Google user,https://play-lh.googleusercontent.com/EGemoI2NTXmTsBVtJqk8jxF9rh8ApRWfsIMQSt2uE4OcpQqbFu7f7NbTK05lx80nuSijCz7sc3a277R67g,ok,5,0,4.80.2,2025-08-09 20:12:25,"Hey there, thank you for the valuable feedback. We request you to let us know more about your experience by writing an email to swiggysocial@swiggy.in so we can make our services better.",2025-08-09 20:22:31,4.80.2
1d643978-4785-4faa-a049-78490538be25,A Google user,https://play-lh.googleusercontent.com/EGemoI2NTXmTsBVtJqk8jxF9rh8ApRWfsIMQSt2uE4OcpQqbFu7f7NbTK05lx80nuSijCz7sc3a277R67g,good super,5,0,4.86.1,2025-08-09 20:12:11,Hey there! Such positive reviews motivate us to strive hard to provide you a much better experience. Happy ordering. 🙂,2025-08-09 20:12:28,4.86.1
b529f102-390a-41fd-bcdb-c7e1e19a169f,A Google user,https://play-lh.googleusercontent.com/EGemoI2NTXmTsBVtJqk8jxF9rh8ApRWfsIMQSt2uE4OcpQqbFu7f7NbTK05lx80nuSijCz7sc3a277R67g,super 💯,5,0,4.86.1,2025-08-09 20:10:09,"Hey, thanks for the rating! This motivates us to keep serving you better with every order.",2025-08-09 20:12:27,4.86.1
f81a501e-53d4-49fb-a9a5-18a50bdfb01b,A Google user,https://play-lh.googleusercontent.com/EGemoI2NTXmTsBVtJqk8jxF9rh8ApRWfsIMQSt2uE4OcpQqbFu7f7NbTK05lx80nuSijCz7sc3a277R67g,SUPERB,4,0,4.86.1,2025-08-09 20:08:20,Hey there! Such positive reviews motivate us to strive hard to provide you a much better experience. We request you to let us know more about your experience by writing an email to swiggysocial@swiggy.in so we can make our services better.,2025-08-09 20:12:27,4.86.1
dfaf00a6-3256-4cb2-a1f5-4724d49339f8,A Google user,https://play-lh.googleusercontent.com/EGemoI2NTXmTsBVtJqk8jxF9rh8ApRWfsIMQSt2uE4OcpQqbFu7f7NbTK05lx80nuSijCz7sc3a277R67g,THIS VERY NICE APP,5,0,4.86.1,2025-08-09 20:05:22,Hey there! Such positive reviews motivate us to strive hard to provide you a much better experience. Happy ordering. 🙂,2025-08-09 20:12:29,4.86.1
3743add2-6fb8-4847-b7e5-7cad17056707,A Google user,https://play-lh.googleusercontent.com/EGemoI2NTXmTsBVtJqk8jxF9rh8ApRWfsIMQSt2uE4OcpQqbFu7f7NbTK05lx80nuSijCz7sc3a277R67g,very good,5,0,4.86.1,2025-08-09 20:05:16,"Hey there, nothing delights us more than hearing this. We are happy that you had a great experience. Keep Swiggying. 🙂",2025-08-09 20:12:26,4.86.1
c3f1faeb-16b5-4340-ab5b-cea6c7247610,A Google user,https://play-lh.googleusercontent.com/EGemoI2NTXmTsBVtJqk8jxF9rh8ApRWfsIMQSt2uE4OcpQqbFu7f7NbTK05lx80nuSijCz7sc3a277R67g,love it..,5,0,4.86.1,2025-08-09 20:04:46,"Hey, we are glad to have patrons like you and will strive towards providing better services to keep such reviews coming our way. Keep ordering.",2025-08-09 20:12:27,4.86.1
2408e691-d610-472f-9287-58c249b84e65,A Google user,https://play-lh.googleusercontent.com/EGemoI2NTXmTsBVtJqk8jxF9rh8ApRWfsIMQSt2uE4OcpQqbFu7f7NbTK05lx80nuSijCz7sc3a277R67g,don't deliver food on time pathetic service,1,0,4.86.1,2025-08-09 20:04:07,"Hey there, we apologize for the inconvenience caused. We request you to kindly let us know more about the issue by writing to us at swiggysocial@swiggy.in from your registered email address, so we can look into it and have it fixed at the earliest.",2025-08-09 20:28:39,4.86.1
15cf02ec-c0bb-4c71-9296-c9561d03a319,A Google user,https://play-lh.googleusercontent.com/EGemoI2NTXmTsBVtJqk8jxF9rh8ApRWfsIMQSt2uE4OcpQqbFu7f7NbTK05lx80nuSijCz7sc3a277R67g,good,5,0,4.83.4,2025-08-09 20:03:26,"Hey there, it's a bliss to see that our service brought a smile to your face. We'll endeavor to keep it up. Keep Swiggying. 😊",2025-08-09 20:29:34,4.83.4
da70f4e2-b766-4e84-87d5-39d465e91073,A Google user,https://play-lh.googleusercontent.com/EGemoI2NTXmTsBVtJqk8jxF9rh8ApRWfsIMQSt2uE4OcpQqbFu7f7NbTK05lx80nuSijCz7sc3a277R67g,nice,5,0,4.86.1,2025-08-09 20:03:25,Hey there! Such positive reviews motivate us to strive hard to provide you a much better experience. Happy ordering. 🙂,2025-08-09 20:12:28,4.86.1
4dda4481-96a5-4db1-b9d6-80eff1275114,A Google user,https://play-lh.googleusercontent.com/EGemoI2NTXmTsBVtJqk8jxF9rh8ApRWfsIMQSt2uE4OcpQqbFu7f7NbTK05lx80nuSijCz7sc3a277R67g,GOOD JOB SWIGY,5,0,4.86.1,2025-08-09 20:02:44,"Hey there, it's a bliss to see that our service brought a smile to your face. We'll endeavor to keep it up. Keep Swiggying. 😊",2025-08-09 20:29:57,4.86.1
eb69d059-1568-4b53-b7e6-cf03c316b44f,A Google user,https://play-lh.googleusercontent.com/EGemoI2NTXmTsBVtJqk8jxF9rh8ApRWfsIMQSt2uE4OcpQqbFu7f7NbTK05lx80nuSijCz7sc3a277R67g,first time ordered with you. Happy with Swiggy...,5,0,4.86.1,2025-08-09 20:02:12,"Hey there, nothing delights us more than hearing this. We are happy that you had a great experience. Keep Swiggying. 🙂",2025-08-09 20:02:27,4.86.1
8f0dc4b0-54ca-4ecd-b3af-33c74406986e,A Google user,https://play-lh.googleusercontent.com/EGemoI2NTXmTsBVtJqk8jxF9rh8ApRWfsIMQSt2uE4OcpQqbFu7f7NbTK05lx80nuSijCz7sc3a277R67g,super,5,0,4.86.1,2025-08-09 20:01:11,Hey there! Such positive reviews motivate us to strive hard to provide you a much better experience. Happy ordering. 🙂,2025-08-09 20:02:30,4.86.1
f6af715c-df4f-4f8a-84b2-1281a77417dc,A Google user,https://play-lh.googleusercontent.com/EGemoI2NTXmTsBVtJqk8jxF9rh8ApRWfsIMQSt2uE4OcpQqbFu7f7NbTK05lx80nuSijCz7sc3a277R67g,good food,5,0,4.86.1,2025-08-09 19:59:50,"Hey, we are glad to have patrons like you and will strive towards providing better services to keep such reviews coming our way. Keep ordering.",2025-08-09 20:02:29,4.86.1
5771b745-ed69-4d64-96ee-c05eadfb35aa,A Google user,https://play-lh.googleusercontent.com/EGemoI2NTXmTsBVtJqk8jxF9rh8ApRWfsIMQSt2uE4OcpQqbFu7f7NbTK05lx80nuSijCz7sc3a277R67g,you are treating your unfairly. when I try to order something it always increases the cost in name of update cost.,1,0,4.86.1,2025-08-09 19:59:42,This shouldn't have happened. Kindly help us with the order ID along with the details of the issue by writing to us at swiggysocial@swiggy.in from your registered email ID & we will have this checked.,2025-08-09 20:02:30,4.86.1
5466ddc4-651a-4992-8248-2c77cce47e71,A Google user,https://play-lh.googleusercontent.com/EGemoI2NTXmTsBVtJqk8jxF9rh8ApRWfsIMQSt2uE4OcpQqbFu7f7NbTK05lx80nuSijCz7sc3a277R67g,best,5,0,4.86.1,2025-08-09 19:59:05,"Hi there, we appreciate your outstanding rating. This motivates us to keep providing exceptional service, as we consistently strive to do.",2025-08-09 20:27:00,4.86.1
ce204d68-c2e0-48e5-ba67-cfd2aa7a8fb4,A Google user,https://play-lh.googleusercontent.com/EGemoI2NTXmTsBVtJqk8jxF9rh8ApRWfsIMQSt2uE4OcpQqbFu7f7NbTK05lx80nuSijCz7sc3a277R67g,nice,5,0,4.86.1,2025-08-09 19:59:00,"Hi there, thank you for your patronage and the perfect rating. We will strive to provide consistent seamless ordering experiences. Keep Swiggying!",2025-08-09 20:02:31,4.86.1
136ad650-8cd2-478e-97ed-9a1c70162cf9,A Google user,https://play-lh.googleusercontent.com/EGemoI2NTXmTsBVtJqk8jxF9rh8ApRWfsIMQSt2uE4OcpQqbFu7f7NbTK05lx80nuSijCz7sc3a277R67g,very good service,5,0,4.86.1,2025-08-09 19:58:30,"Hey there, nothing delights us more than hearing this. We are happy that you had a great experience. Keep Swiggying. 🙂",2025-08-09 20:26:00,4.86.1
0e6d8a58-3932-491a-ac77-5ce56904e4db,A Google user,https://play-lh.googleusercontent.com/EGemoI2NTXmTsBVtJqk8jxF9rh8ApRWfsIMQSt2uE4OcpQqbFu7f7NbTK05lx80nuSijCz7sc3a277R67g,good,5,0,4.86.1,2025-08-09 19:57:22,"Hi there, thank you for your patronage and the perfect rating. We will strive to provide consistent seamless ordering experiences. Keep Swiggying!",2025-08-09 20:02:29,4.86.1
8a5851db-7c8b-442e-b059-e44dc825577e,A Google user,https://play-lh.googleusercontent.com/EGemoI2NTXmTsBVtJqk8jxF9rh8ApRWfsIMQSt2uE4OcpQqbFu7f7NbTK05lx80nuSijCz7sc3a277R67g,The best app for the food delivery in india I wanted to give 5 star rating but I am giving 4 star rating because customer care service is not good,4,0,4.86.1,2025-08-09 19:56:50,"Hey there, we are thankful to you for your review! We request you to let us know more about your experience by writing an email to swiggysocial@swiggy.in so we can make our services better.",2025-08-09 20:02:29,4.86.1
86d80058-fa2b-4256-b3eb-7fe481ec6cd7,A Google user,https://play-lh.googleusercontent.com/EGemoI2NTXmTsBVtJqk8jxF9rh8ApRWfsIMQSt2uE4OcpQqbFu7f7NbTK05lx80nuSijCz7sc3a277R67g,good service,5,0,4.84.2,2025-08-09 19:55:16,"Hi there, we appreciate your outstanding rating. This motivates us to keep providing exceptional service, as we consistently strive to do.",2025-08-09 20:53:04,4.84.2
f0670f91-1b2c-4717-b86f-28853957b0ea,A Google user,https://play-lh.googleusercontent.com/EGemoI2NTXmTsBVtJqk8jxF9rh8ApRWfsIMQSt2uE4OcpQqbFu7f7NbTK05lx80nuSijCz7sc3a277R67g,Amazing 😍,5,0,4.86.1,2025-08-09 19:54:43,"Hey there, thank you for the perfect ratings. We appreciate your efforts in contributing to our improvements.",2025-08-09 20:02:27,4.86.1
2db25b6f-9d7d-43eb-825b-8b14cc9a4030,A Google user,https://play-lh.googleusercontent.com/EGemoI2NTXmTsBVtJqk8jxF9rh8ApRWfsIMQSt2uE4OcpQqbFu7f7NbTK05lx80nuSijCz7sc3a277R67g,good 👍,5,0,4.86.1,2025-08-09 19:54:40,"Hey, thanks for the rating! This motivates us to keep serving you better with every order.",2025-08-09 20:02:27,4.86.1
5b9c6fcf-ca56-4b90-ba90-a5bad2754cff,A Google user,https://play-lh.googleusercontent.com/EGemoI2NTXmTsBVtJqk8jxF9rh8ApRWfsIMQSt2uE4OcpQqbFu7f7NbTK05lx80nuSijCz7sc3a277R67g,Pathetic customer service. This company is going to shut for sure.,1,0,4.86.1,2025-08-09 19:54:08,"Hi there, we are sorry for any hassle you have faced while ordering with us. Please share the order ID along with the details of the issue by writing to us at swiggysocial@swiggy.in from your registered email address and we would be happy to connect with you and resolve the matter.",2025-08-09 20:02:26,4.86.1
5141de0f-bbbd-42fd-9711-a07fd075195e,A Google user,https://play-lh.googleusercontent.com/EGemoI2NTXmTsBVtJqk8jxF9rh8ApRWfsIMQSt2uE4OcpQqbFu7f7NbTK05lx80nuSijCz7sc3a277R67g,"*Worst Experience – Never Using Swiggy Again I ordered food from KFC via Swiggy and received spoiled chicken that smelled terrible – a serious food safety hazard. Despite reporting it with proof, Swiggy didn’t bother to resolve the issue. If a company can’t handle basic food safety complaints, it has no respect for its customers. I’m deleting this app and will never order from them again. Avoid Swiggy – they are useless when it comes to customer care.",1,0,4.86.1,2025-08-09 19:53:54,"Hey there, we would like to get this checked to see what went wrong. Kindly help us with your registered details at swiggysocial@swiggy.in and we will do what it takes to turn this around!",2025-08-09 20:02:29,4.86.1
0014af58-5e8f-4669-abc1-8acc1b1fba90,A Google user,https://play-lh.googleusercontent.com/EGemoI2NTXmTsBVtJqk8jxF9rh8ApRWfsIMQSt2uE4OcpQqbFu7f7NbTK05lx80nuSijCz7sc3a277R67g,good,5,0,4.86.1,2025-08-09 19:52:56,"Hey, thanks for the rating! This motivates us to keep serving you better with every order.",2025-08-09 20:02:28,4.86.1
19cb9207-994a-45d5-a0d2-2f1bf6edeaa3,A Google user,https://play-lh.googleusercontent.com/EGemoI2NTXmTsBVtJqk8jxF9rh8ApRWfsIMQSt2uE4OcpQqbFu7f7NbTK05lx80nuSijCz7sc3a277R67g,"Swiggy offers a generally positive experience, though it has some inconsistencies. The application itself is user-friendly, and customer support is often helpful. However, the reliability of delivery services can vary significantly. While many delivery partners provide excellent service, some contribute to negative experiences, and there are concerns about potential fraudulent activities. If Swiggy were to implement measures to ensure consistent performance among all areas, it would be the best.",3,15,4.85.2,2025-08-09 19:52:55,"Hey, thank you for the ratings. We request you to let us know more about your experience by writing an email to swiggysocial@swiggy.in so we can make our services better.",2025-08-09 20:02:28,4.85.2
ccf344a4-b62e-40f1-9782-6389eaa5b3bf,A Google user,https://play-lh.googleusercontent.com/EGemoI2NTXmTsBVtJqk8jxF9rh8ApRWfsIMQSt2uE4OcpQqbFu7f7NbTK05lx80nuSijCz7sc3a277R67g,swiggy is soper,5,0,4.84.0,2025-08-09 19:51:08,"Hey there, we are thankful to you for your review! We request you to let us know more about your experience by writing an email to swiggysocial@swiggy.in so we can make our services better.",2025-08-09 19:52:33,4.84.0
d8c2e80d-a797-4ca5-ac5a-7f7206a8c079,A Google user,https://play-lh.googleusercontent.com/EGemoI2NTXmTsBVtJqk8jxF9rh8ApRWfsIMQSt2uE4OcpQqbFu7f7NbTK05lx80nuSijCz7sc3a277R67g,nice,5,0,4.84.1,2025-08-09 19:50:13,"Hey there, nothing delights us more than hearing this. We are happy that you had a great experience. Keep Swiggying. 🙂",2025-08-09 19:52:34,4.84.1
14c2b51d-89b8-4dc1-ac4b-d060ded421aa,A Google user,https://play-lh.googleusercontent.com/EGemoI2NTXmTsBVtJqk8jxF9rh8ApRWfsIMQSt2uE4OcpQqbFu7f7NbTK05lx80nuSijCz7sc3a277R67g,that is good app,5,0,4.86.1,2025-08-09 19:49:40,We are happy to hear such positive feedback. 🙂,2025-08-09 19:52:32,4.86.1
54c30ace-be3b-4724-99c3-09bd25a1fa71,A Google user,https://play-lh.googleusercontent.com/EGemoI2NTXmTsBVtJqk8jxF9rh8ApRWfsIMQSt2uE4OcpQqbFu7f7NbTK05lx80nuSijCz7sc3a277R67g,very good,5,0,4.86.1,2025-08-09 19:48:40,Hey there! It's a bliss to see that our service brought a smile to your face. We'll endeavor to keep it up. Keep Swiggying. 🙂,2025-08-09 19:52:33,4.86.1
6080a33f-94b1-4eff-865b-57ad8b7ccaf4,A Google user,https://play-lh.googleusercontent.com/EGemoI2NTXmTsBVtJqk8jxF9rh8ApRWfsIMQSt2uE4OcpQqbFu7f7NbTK05lx80nuSijCz7sc3a277R67g,this application is really bad because I have mistakenly ordered it and within a minute I have cancelled the order but it will charge me 100% of cancellation charges fees this policy is really bad and I am a Swiggy one premium membership customer but I didn't get any support from the team...,1,0,,2025-08-09 19:47:05,"Hi there, we are sorry for any hassle you have faced while ordering with us. Please share the order ID along with the details of the issue by writing to us at swiggysocial@swiggy.in from your registered email address and we would be happy to connect with you and resolve the matter.",2025-08-09 19:52:34,
8405d944-9851-44d6-9005-5509ee94cde4,A Google user,https://play-lh.googleusercontent.com/EGemoI2NTXmTsBVtJqk8jxF9rh8ApRWfsIMQSt2uE4OcpQqbFu7f7NbTK05lx80nuSijCz7sc3a277R67g,nice,5,0,,2025-08-09 19:46:27,"It's a pleasure to have you as a customer, and we'll strive to enhance our services so that positive feedback like yours remains frequent. We look forward to your next order.",2025-08-09 20:43:35,
b53d0072-959a-4ffe-9b5e-d68977f6992b,A Google user,https://play-lh.googleusercontent.com/EGemoI2NTXmTsBVtJqk8jxF9rh8ApRWfsIMQSt2uE4OcpQqbFu7f7NbTK05lx80nuSijCz7sc3a277R67g,good,5,0,4.85.2,2025-08-09 19:46:15,"Hi there, thank you for your patronage and the perfect rating. We will strive to provide consistent seamless ordering experiences. Keep Swiggying!",2025-08-09 19:52:31,4.85.2
5e7bad68-df37-4795-b6bb-076a7f7b3cee,A Google user,https://play-lh.googleusercontent.com/EGemoI2NTXmTsBVtJqk8jxF9rh8ApRWfsIMQSt2uE4OcpQqbFu7f7NbTK05lx80nuSijCz7sc3a277R67g,good day,5,0,4.83.4,2025-08-09 19:44:37,"Hey there, thank you for the perfect ratings. We appreciate your efforts in contributing to our improvements.",2025-08-09 19:52:34,4.83.4
b5d478bf-5e1f-4926-bd0b-98d16e29a9a7,A Google user,https://play-lh.googleusercontent.com/EGemoI2NTXmTsBVtJqk8jxF9rh8ApRWfsIMQSt2uE4OcpQqbFu7f7NbTK05lx80nuSijCz7sc3a277R67g,super,5,0,4.86.1,2025-08-09 19:43:54,"Hey there, nothing delights us more than hearing this. We are happy that you had a great experience. Keep Swiggying. 🙂",2025-08-09 19:52:34,4.86.1
d2fdfa6b-81ec-4681-a952-47f4b34fefcc,A Google user,https://play-lh.googleusercontent.com/EGemoI2NTXmTsBVtJqk8jxF9rh8ApRWfsIMQSt2uE4OcpQqbFu7f7NbTK05lx80nuSijCz7sc3a277R67g,0/5 they steal your money through cancellation fees with stupid reasons that restaurants have already accepted your order within a minute so we change 100% fee and we don't give you food.,1,0,,2025-08-09 19:43:32,"Hey there, we are sorry to have put you through such a situation. We would like to make amends and request you to kindly share the order ID along with the details of your concern at swiggysocial@swiggy.in and we will do what it takes to turn this around!",2025-08-09 19:52:34,
29ef0e6b-d58a-4826-965c-dbcaf521a434,A Google user,https://play-lh.googleusercontent.com/EGemoI2NTXmTsBVtJqk8jxF9rh8ApRWfsIMQSt2uE4OcpQqbFu7f7NbTK05lx80nuSijCz7sc3a277R67g,good,5,0,4.78.2,2025-08-09 19:43:21,Hey there! Such positive reviews motivate us to strive hard to provide you a much better experience. Happy ordering. 🙂,2025-08-09 19:52:32,4.78.2
7c173975-95b5-461e-89fb-839e219e6459,A Google user,https://play-lh.googleusercontent.com/EGemoI2NTXmTsBVtJqk8jxF9rh8ApRWfsIMQSt2uE4OcpQqbFu7f7NbTK05lx80nuSijCz7sc3a277R67g,very nice,5,0,4.86.1,2025-08-09 19:42:56,"It's a pleasure to have you as a customer, and we'll strive to enhance our services so that positive feedback like yours remains frequent. We look forward to your next order.",2025-08-09 20:43:28,4.86.1
bce423ff-132a-42db-abff-b79aadb2648e,A Google user,https://play-lh.googleusercontent.com/EGemoI2NTXmTsBVtJqk8jxF9rh8ApRWfsIMQSt2uE4OcpQqbFu7f7NbTK05lx80nuSijCz7sc3a277R67g,supab,5,0,4.86.1,2025-08-09 19:42:06,"Hey, thank you for your kind review. We hope to keep on giving you a consistent service every time. We request you to let us know more about your experience by writing an email to swiggysocial@swiggy.in so we can make our services better.",2025-08-09 19:42:41,4.86.1
98fc25aa-b7ab-49c1-ac46-1dbd861492df,A Google user,https://play-lh.googleusercontent.com/EGemoI2NTXmTsBVtJqk8jxF9rh8ApRWfsIMQSt2uE4OcpQqbFu7f7NbTK05lx80nuSijCz7sc3a277R67g,super,5,0,4.85.2,2025-08-09 19:39:28,"Hi there, thank you for your patronage and the perfect rating. We will strive to provide consistent seamless ordering experiences. Keep Swiggying!",2025-08-09 19:42:44,4.85.2
e82c53d5-a97a-42fa-8837-cd323663e9cd,A Google user,https://play-lh.googleusercontent.com/EGemoI2NTXmTsBVtJqk8jxF9rh8ApRWfsIMQSt2uE4OcpQqbFu7f7NbTK05lx80nuSijCz7sc3a277R67g,good 👍,5,0,4.86.1,2025-08-09 19:38:52,"Hey, we are glad to have patrons like you and will strive towards providing better services to keep such reviews coming our way. Keep ordering.",2025-08-09 19:42:44,4.86.1
fc88fd20-57a1-4577-a230-62db6b9756af,A Google user,https://play-lh.googleusercontent.com/EGemoI2NTXmTsBVtJqk8jxF9rh8ApRWfsIMQSt2uE4OcpQqbFu7f7NbTK05lx80nuSijCz7sc3a277R67g,first of a nice offer,4,0,4.86.1,2025-08-09 19:38:05,Hey there! Such positive reviews motivate us to strive hard to provide you a much better experience. We request you to let us know more about your experience by writing an email to swiggysocial@swiggy.in so we can make our services better.,2025-08-09 19:42:44,4.86.1
6fa6530b-de89-46ba-9595-68da9b40daeb,A Google user,https://play-lh.googleusercontent.com/EGemoI2NTXmTsBVtJqk8jxF9rh8ApRWfsIMQSt2uE4OcpQqbFu7f7NbTK05lx80nuSijCz7sc3a277R67g,ok,3,0,,2025-08-09 19:37:15,"Hey, thank you for your kind review. We hope to keep on giving you a consistent service every time. We request you to let us know more about your experience by writing an email to swiggysocial@swiggy.in so we can make our services better.",2025-08-09 19:42:41,
0fc5240d-d060-45f5-bee9-406da2952fd3,A Google user,https://play-lh.googleusercontent.com/EGemoI2NTXmTsBVtJqk8jxF9rh8ApRWfsIMQSt2uE4OcpQqbFu7f7NbTK05lx80nuSijCz7sc3a277R67g,good service,5,0,4.86.1,2025-08-09 19:37:06,"Hey there, thank you for the perfect ratings. We appreciate your efforts in contributing to our improvements.",2025-08-09 19:42:43,4.86.1
