reviewId,userName,userImage,content,score,thumbsUpCount,reviewCreatedVersion,at,replyContent,repliedAt,appVersion
41288b21-08d8-403f-9ede-ed62d24bbe53,Shweta Mishra,https://play-lh.googleusercontent.com/a/ACg8ocKoG5kHDVIGbOoe33x9jOWWHAAKQYXMUydrWzlYFJHkfQBugg=mo,tasty and pure dish,5,0,4.83.4,2025-07-26 17:43:57,"Hey, thanks for the rating! This motivates us to keep serving you better with every order.",2025-07-26 17:52:33,4.83.4
14e322c5-6c3b-4eaf-ae97-2bdf10cab2e6,Shafeeq P U,https://play-lh.googleusercontent.com/a-/ALV-UjURRg70oOC3umrQVEfliQgtK428VAYhF_6CddVHLBK2SEOBFjSR,bad experience. they take no responsibility over food and delivery. Really waste of money and time. it took 2 hrs for delivery.,1,1,4.65.1,2025-07-26 17:42:25,"Hey there, we are sorry for the unpleasant experience you had. Please share more details about the incident by writing an email at swiggysocial@swiggy.in from your registered email ID. we'll take it up.",2025-07-26 17:52:34,4.65.1
ac120897-a64f-4236-b357-95dae9a8faf3,AMIT KUMAR SINGH,https://play-lh.googleusercontent.com/a-/ALV-UjWgFAsTwA0zFcPpnAY0qliQANztloiNZv67D1FXVGltnKKu_ajo,Poor Service,1,0,4.83.2,2025-07-26 17:38:27,"Hey, thank you for the ratings. We request you to let us know more about your experience by writing an email to swiggysocial@swiggy.in, so we can make our services better.",2025-07-26 19:06:00,4.83.2
1520c178-dacb-4408-901f-c2fc075b9e9a,Fall Ditch,https://play-lh.googleusercontent.com/a/ACg8ocJYPfeZqcwgvYTTTGng1SYbeOiHkTtHN5CH5Xx1NUTlZU9biA=mo,swiggy 10 nahin 25 minut mein delivery deta hai four delivery charge alag se lagata hai agar 50 rupay ka saman Manga rahe ho to 150 rupaye to delivery charge Dena padega aapko aapko free Mil Rahe Hain vah free very kuchh nahin Mil Raha Hai jab jakar vah aapke paise sim mein jud jaenge recharge four free lag jaega,1,0,,2025-07-26 17:37:31,"Hello, we're sorry for the unpleasant experience. Please share your concern along with your order details via email at swiggysocial@swiggy.in so that we will look into this & assist you better.",2025-07-26 17:42:30,
f1e5d41a-723c-4a51-93db-2c3d0debe56e,Miraj Hossain Laskar,https://play-lh.googleusercontent.com/a/ACg8ocJxUl5o3WGuYzus_FmxjWZMz3uL6zbvk7IDFe6emJn4qQJ5=mo,good but price too much high 😔,4,0,4.84.2,2025-07-26 17:37:20,"Hello there, thank you for your review. Please do share your valuable feedback with us by writing at Swiggysocial@swiggy.in from your registered mailbox so that we can improve our services to the next level.",2025-07-26 17:42:30,4.84.2
72bd1f0b-5fb9-456f-8c7d-c7382b752e80,Ayush Kumar,https://play-lh.googleusercontent.com/a-/ALV-UjUG59y2xOchq98Hqm5k9fdYYHmsa0Sx3Bmv1LW_Ls3iB5QVv6Cr,good 👍,5,0,4.84.2,2025-07-26 17:36:20,Hey there! It's a bliss to see that our service brought a smile to your face. We'll endeavor to keep it up. Keep Swiggying. 🙂,2025-07-26 17:42:30,4.84.2
43af46ba-6a84-45bf-a34f-7c5fdc1e9f8c,Tejinder Kaur,https://play-lh.googleusercontent.com/a/ACg8ocL4_FWl5X4mWHZt4ApK2BmscrWwiVN-7vijfLTkmclKPAaG5g=mo,good,4,0,4.82.1,2025-07-26 17:36:04,"Hey, thanks for the rating! This motivates us to keep serving you better with every order. We would love to hear from you about how we could hit the 5-star rating. Please do share your thoughts by dropping an email at swiggysocial@swiggy.in.",2025-07-26 17:42:31,4.82.1
6072fe00-2d2c-4b1d-8109-fb7d34e82704,sakthi kanthi,https://play-lh.googleusercontent.com/a-/ALV-UjVIWaOqYG7yWrZ8N8pSburrrUZeIpmTjK4Uo33UrBaxUtvHSpaO,Price is too high in second tire cities,1,0,4.84.2,2025-07-26 17:34:23,This shouldn't have happened. Kindly help us with the order ID along with the details of the issue by writing to us at swiggysocial@swiggy.in from your registered email ID & we will have this checked.,2025-07-26 17:42:31,4.84.2
287d1a22-483c-470e-89cc-bf747e9864ef,Bhabesh Mahato,https://play-lh.googleusercontent.com/a-/ALV-UjU0Dism0ALYSq7zAQQZMz6B1Fdco0l5TgDnwwMpqqf4AMy9WtMj,😂❤️🙏,2,0,4.84.2,2025-07-26 17:33:47,"Hi, please write to us about your experience at swiggysocial@swiggy.in from your registered email address, so we can better our services.",2025-07-26 17:42:30,4.84.2
5ede8c9b-b6ce-4d73-b10e-bd1fc6428b01,Ishant Sharma,https://play-lh.googleusercontent.com/a/ACg8ocL1BXMWkNaR_3-F1WOhD9htUnHdkC4bTk-hpIy1GQJLOitnlQ=mo,good,4,0,4.84.2,2025-07-26 17:31:51,Hey there! Such a bliss! We request you to let us know more about your experience by writing an email to swiggysocial@swiggy.in so we can make our services better.,2025-07-26 17:32:28,4.84.2
242efdfc-0e9c-4a03-b86d-04143fda6718,Akash kumar,https://play-lh.googleusercontent.com/a-/ALV-UjWsnTIo1Hb0Y9Cp6rvmwhVwCSa-ix4ypRnNDiCRkL_cboYMwgk,good,5,0,4.84.1,2025-07-26 17:27:48,Hey there! It's a bliss to see that our service brought a smile to your face. We'll endeavor to keep it up. Keep Swiggying. 🙂,2025-07-26 17:32:29,4.84.1
2cec6c7c-99f5-479f-982b-5df4477ed7ab,Raju Sangala,https://play-lh.googleusercontent.com/a-/ALV-UjW8kLfuEj6b-kJPEpBJUkJ8t_n_lQRbSnGmdowIgwBNyP58aa-PnQ,good service,5,0,4.84.2,2025-07-26 17:24:31,"It's a pleasure to have you as a customer, and we'll strive to enhance our services so that positive feedback like yours remains frequent. We look forward to your next order.",2025-07-26 19:05:40,4.84.2
2dd30b0a-3093-43b6-baab-dcf315ad9434,Sahil Goswami,https://play-lh.googleusercontent.com/a-/ALV-UjXpbI9IJ2mjujSgPVMnHM-oa5CijYNH9bt0fUJaRs55sAGV32I,my love Swiggy team,5,0,4.84.2,2025-07-26 17:24:30,"It's a pleasure to have you as a customer, and we'll strive to enhance our services so that positive feedback like yours remains frequent. We look forward to your next order.",2025-07-26 19:05:30,4.84.2
ff8d748b-2a00-466f-a9db-3712c95c9a51,pooja banerji,https://play-lh.googleusercontent.com/a-/ALV-UjVBQ0JJuQZvZs1-NTjFU50JydELqXJSiwRImtasb9Br5uKh8mM,Terrible delivery and delivery partners. Edit 1. They also have hired fools as customer care. It took me 40 minutes the idiot wasn't able to resolve it. Was just programmed like a bot to use sweet nothings. 💩💩 Edit 2. Mcdonald's mcveggie med meal s Rs 200 but here they are charging 230 plus gst which lands at 275 or 280. Edit 3. Everything which the restaurants sells on price including gst... these apps charge that price and add gst again n delivery charge etc to charge more.,1,0,4.84.2,2025-07-26 17:22:04,"Hey there, please drop an email at swiggysocial@swiggy.in with your order ID, it will help us get this checked and get back to you with an apt resolution.",2025-07-26 17:22:38,4.84.2
7e91385e-e555-457c-b376-b613af847257,Consult SKAB,https://play-lh.googleusercontent.com/a-/ALV-UjWlJfHeab7t0wRBh1GmENGxESTVMQ9quK9aTimEdh7MebGwDwsLTw,ordered food. after an hour order cancelled by merely ivr call. no customer service. nothing.,1,0,,2025-07-26 17:21:22,"We're apologetic about this experience you've faced while ordering with us. Please write to us at swiggysocial@swiggy.in from your registered email address detailing your experience, so we can look into the issue and resolve it for you.",2025-07-26 17:22:38,
0cf60898-38eb-494e-8169-ed8e43167e65,Soham Kankudate,https://play-lh.googleusercontent.com/a/ACg8ocJCGRJaNQH22H0HyZwEwxvgde7WZdHok_r5qsIKAn20N62eWg=mo,good 👍🏻😊,5,0,,2025-07-26 17:14:43,"Hi there, thank you for your patronage and the perfect rating. We will strive to provide consistent seamless ordering experiences. Keep Swiggying!",2025-07-26 17:22:39,
d8f5b102-1839-48c7-be10-2950d2dc0ccc,Sufiyan Sheikh,https://play-lh.googleusercontent.com/a/ACg8ocJN8wmyuBS7dYH-szHbN6i57qelqlDjKy1-G3mp43GW9_BzgQ=mo,thank,5,0,4.84.2,2025-07-26 17:09:16,"Hi Sufiyan, thank you for the excellent rating. This will inspire us to continue delivering exceptional service as we always do.

^ Sohom",2025-07-26 17:32:41,4.84.2
7a39fd7e-0081-41af-9fd4-79743851d46a,Vijay Fdo,https://play-lh.googleusercontent.com/a/ACg8ocLXzQFt8dPxeSgRWoJv42bUnEQvsObHBz0G-QQdfjd2JI4KHg=mo,super 🥰🥰,5,0,4.84.2,2025-07-26 17:08:47,"Hi there, thank you for your patronage and the perfect rating. We will strive to provide consistent seamless ordering experiences. Keep Swiggying!",2025-07-26 17:12:58,4.84.2
53e4a56f-8280-4c4c-b5b2-13a0140faeef,Shoba Divase,https://play-lh.googleusercontent.com/a/ACg8ocKOdCR9g8RuNsHAzlMbsfnQbJrAg371FBxYhxzSiITBt1j0Pw=mo,BEST!!!!!,5,0,4.84.2,2025-07-26 17:07:54,"Hey, thanks for the rating! This motivates us to keep serving you better with every order.",2025-07-26 17:12:57,4.84.2
56eb2626-8df7-4373-be25-1063996184c1,Shivangi Singh,https://play-lh.googleusercontent.com/a-/ALV-UjVCooGn-KmzDAFeQYcCZ1MsbPDCZVdep87rKjpuCIUka2O0rfEP,"don't know why they even give a help option, when not once they seem to want to help users. worst ever service is provided by Swiggy without hesitation. they don't care of consumers which gives resturants free do wrong and don't worry about it cause app doesn't care for the same.",1,0,4.84.2,2025-07-26 17:07:02,"Hey there, we would like to get this checked to see what went wrong. Kindly help us with your registered details at swiggysocial@swiggy.in and we will do what it takes to turn this around!",2025-07-26 17:12:59,4.84.2
94c490f0-db98-4144-b6d5-593896549916,sourav sk,https://play-lh.googleusercontent.com/a/ACg8ocLlL2qeTxBxSus3JS7_Rusjs_Gkzw8XqZyBPfFJheL7_SAUOg=mo,good,1,0,4.84.2,2025-07-26 17:02:59,"Hi, please let us know how we can make our service better by writing to us at swiggysocial@swiggy.in from your registered email address.",2025-07-26 17:12:58,4.84.2
6bd926ee-931c-485c-a365-48d59bd1fabb,Deep Banger,https://play-lh.googleusercontent.com/a/ACg8ocLuOuynz7hzYBvA_o61CW3YAuauwCIGHWj4ImNWD_6djk9mEQ=mo,gooood,5,0,4.84.2,2025-07-26 17:02:20,"Hey there, nothing delights us more than hearing this. We are happy that you had a great experience. Keep Swiggying. 🙂",2025-07-26 17:02:36,4.84.2
2de334d9-2526-40c5-b0e1-8783d4c97b23,Sujit kumar,https://play-lh.googleusercontent.com/a-/ALV-UjX5GorJQv6EGsvL_wt7Vm-elYxVwUod7E60vDsvrw8HlLqw8d-o,faltu sab se faltu app hai,1,0,4.84.2,2025-07-26 16:57:23,This shouldn't have happened. Kindly help us with the order ID along with the details of the issue by writing to us at swiggysocial@swiggy.in from your registered email ID & we will have this checked.,2025-07-26 17:02:37,4.84.2
8a1cab75-eb65-4621-8f79-572e9c79f2fc,vishnu swaroop srivastava,https://play-lh.googleusercontent.com/a-/ALV-UjUGl2IW4kY3WEAXApEmKGDKGkbb7fSnOzyjHPUP6UmSPN7pA05e,Good service. Full satisfaction,5,0,4.78.2,2025-07-26 16:56:52,"Hey there, thank you for the perfect ratings. We appreciate your efforts in contributing to our improvements.",2025-07-26 17:02:37,4.78.2
89347fbf-014a-4737-b87d-f0c1e1c577ab,shivam kumar,https://play-lh.googleusercontent.com/a/ACg8ocKsxkztj8wj-xdjHMGodf61NJ-xLFnovnpSaZH9BZi_j-_crM8=mo,good 👍,5,0,4.84.2,2025-07-26 16:53:57,"Hey there, nothing delights us more than hearing this. We are happy that you had a great experience. Keep Swiggying. 🙂",2025-07-26 17:02:35,4.84.2
98ad44c1-ac68-4630-a8d4-40d0d8f7e909,Pradumn raj kumar,https://play-lh.googleusercontent.com/a-/ALV-UjXjH1qVXSv1n-SRfYUNr24UrICsXKa650D4CO96y08XU7kF58rB,unable to install the app.,1,0,,2025-07-26 16:53:52,"Hello, we would like to know more about it. Please write to us at swiggysocial@swiggy.in with relevant details elaborating further on your ordering experience with us, so we can set this right for you.",2025-07-26 17:02:36,
09998cee-5e48-4720-aba4-0e3bcb8ff908,Poonam Singh,https://play-lh.googleusercontent.com/a-/ALV-UjU1kQa1P9zsTwInOwEGQUUYKwSZ1zFYeXzyr8oRjnDeeYHuy4OA,nice,5,0,4.84.2,2025-07-26 16:53:35,"Hi there, thank you for your patronage and the perfect rating. We will strive to provide consistent seamless ordering experiences. Keep Swiggying!",2025-07-26 17:02:36,4.84.2
df6cda0d-a219-44e3-a303-be3116f506fa,Shaik Ustad shoaib,https://play-lh.googleusercontent.com/a-/ALV-UjVTlkuOjI43Dysm9BBgmRpIGSKjsZlOYOCop4WsCg2w5tI__bbw,good,5,0,,2025-07-26 16:53:16,"Hey there, thank you for the perfect ratings. We appreciate your efforts in contributing to our improvements.",2025-07-26 17:02:37,
fcdfe059-000d-4316-ab9f-57511cfd27fb,jadid haque,https://play-lh.googleusercontent.com/a/ACg8ocIWnL2TyzZBCj8LgVTLE186A4ZzrWmQ8ID__1DagyxFbCb6kA=mo,"Fraud The delivery person arrived 1.5 later after , first of all he was drunk and second he did not even bring my order I talked to customer care, they said they have no option to refund as the order is already showing as delivered(how that only God and Swiggy would know). They then told me to mail to a specific email to get things sorted. This was a great failure of supply chain, food was late, food was not here, food was still delivered and no refund for food which I did not get. Great work",1,0,4.84.2,2025-07-26 16:52:19,"Hey there, we apologize for the inconvenience caused. We request you to kindly let us know more about the issue by writing to us at swiggysocial@swiggy.in from your registered email address, so we can look into it and have it fixed at the earliest.",2025-07-26 17:02:37,4.84.2
351802c8-8085-4807-87ba-1a8160342f37,Udayakumar Chalavadi,https://play-lh.googleusercontent.com/a/ACg8ocJGAcvcYt4D5YmwO6piX_LaNtChpwF8bSZQilnZY-zXnKLMpg=mo,super,5,0,4.84.2,2025-07-26 16:51:24,Hey there! It's a bliss to see that our service brought a smile to your face. We'll endeavor to keep it up. Keep Swiggying. 🙂,2025-07-26 16:52:21,4.84.2
6b807f8a-7214-44ae-9ad5-0ac610130b18,AKSHAT SHUKLA,https://play-lh.googleusercontent.com/a-/ALV-UjVJZm5r5X2CNzlm1q_OZry22sKLg1y9UDbZPSLlAfeowRHTsBvZ,Ordering from Swiggy is the worst experience yet. the customer support restricts you from sending messages at their convenience.,1,1,4.84.2,2025-07-26 16:50:00,This shouldn't have happened. Kindly help us with the order ID along with the details of the issue by writing to us at swiggysocial@swiggy.in from your registered email ID & we will have this checked.,2025-07-26 16:52:21,4.84.2
1c35f6ef-4d79-464d-abdc-103828f26ee6,Arun Kumar,https://play-lh.googleusercontent.com/a/ACg8ocJ-yrviJkA4qEpQ3hCdFXvkWX8AY9E67UFb4Exn50ucfDk1jA=mo,best application,5,0,4.84.2,2025-07-26 16:46:11,"Hey there, thank you for the perfect ratings. We appreciate your efforts in contributing to our improvements.",2025-07-26 16:52:21,4.84.2
409d74ed-4b49-42b7-9cc7-475a968d3b92,Pratiksha Sharma,https://play-lh.googleusercontent.com/a-/ALV-UjWNs10bTMACD3oTCmSA6Jj1GYgZaY_L13sT7DyrdDdhE__0tW3Q,Very convenient and quick. Really good !! I strongly recommend.,5,0,,2025-07-26 16:45:41,"Hi Pratiksha, we appreciate your outstanding rating. This motivates us to keep providing exceptional service, as we consistently strive to do.

^ Sohom",2025-07-26 17:37:54,
a14c1c5d-5da7-461f-ab18-cf0b53fe9bae,Anand Kashyap,https://play-lh.googleusercontent.com/a/ACg8ocKqxlRGm8zcQPAPW1R9f9gStgPI38I1pDYlvjlmjAbv_dbfiAmC=mo,nice,5,0,4.85.1,2025-07-26 16:44:22,"Hey, we are glad to have patrons like you and will strive towards providing better services to keep such reviews coming our way. Keep ordering.",2025-07-26 16:52:21,4.85.1
f9582b91-57d2-47d4-9e65-7277f709087b,Ajaz Shaikh,https://play-lh.googleusercontent.com/a-/ALV-UjWZ6a6KBnex13PoP_A3k4Y0vaYDyXnQVbe4cNOyeUZqn9C0ne118A,You should have an option for a real person customer care instead to this useless Ai Bot,1,0,4.84.2,2025-07-26 16:41:17,"Hi Ajaz, we sincerely apologize for this experience. Please reach out to us at swiggysocial@swiggy.in using your registered email address and provide details about your experience so we can investigate the matter and address it for you.

^ Sohom",2025-07-26 17:34:01,4.84.2
64d4f81a-05be-46d8-ad23-5ea2812d78dc,Wazid Ali,https://play-lh.googleusercontent.com/a-/ALV-UjX2VZSorPu1vDyHahXo2w-Qqv7p98gwlkopGZAp8yO4w2BsNRCpyw,"I am writing to express my deep frustration with the appalling service I recently experienced while placing a bulk order through Swiggy. Not only was my order incorrectly split into two, but only half of it was delivered, leaving me in a highly inconvenient situation. Despite multiple follow-ups via email, I have yet to receive a proper resolution or even a satisfactory response from your support team. This level of negligence is unacceptable, especially for a platform that claims to prioritize",1,5,4.83.4,2025-07-26 16:33:19,"Hi there, we sincerely apologize for this experience. Please reach out to us at swiggysocial@swiggy.in using your registered email address and provide details about your experience, so we can investigate the matter and address it for you.",2025-07-26 17:49:48,4.83.4
62d767e4-c99a-49ef-acca-f5d1391eb6f9,Jyoti Roy,https://play-lh.googleusercontent.com/a/ACg8ocJkA5TrWsV24SDnc6mb0hfr7EWTTGc_bR6UTEs-r6M7gJQzBg=mo,"1st order 120 takar thali just 29 takai ,so thank you Swiggy,ato sundor offer er jonno ,thank u very much",5,0,4.84.2,2025-07-26 16:30:43,"Hi there, we appreciate your outstanding rating. This motivates us to keep providing exceptional service, as we consistently strive to do.
",2025-07-26 18:00:46,4.84.2
9370a2b1-2535-4e71-9eaf-0e539f01e91c,GUN /ACE GAmING,https://play-lh.googleusercontent.com/a-/ALV-UjXLM66fdQ6pHNwBSbTF4rhl5mKwWPx6sQIQeaM0gx8okBTb6Bar,good,4,0,4.84.2,2025-07-26 16:29:45,"Hi there, thank you for the review and the stars. We would love to hear from you about how we could hit the 5-star rating. Please do share your thoughts by dropping an email from your registered address at swiggysocial@swiggy.in. Looking forward to hearing from you. Keep Swiggying till then. 😊",2025-07-26 16:32:40,4.84.2
bfc6078a-0f67-4bd7-b465-eca4b20e8f5d,Vaibhav Borade,https://play-lh.googleusercontent.com/a/ACg8ocLb2H_4UYqhzPlHgKzlJmn81JBbVAG50h_APbYlyANDzQBySCs=mo,"This order is not placed from my side. my order is showing in my cart. your Swiggy representative told me this is our system mistake. pls take order, I denied the same. I will not bear charges. don't pressurise me.",1,0,4.84.2,2025-07-26 16:28:44,"Hi, we are sorry about this. Please help us with the order id over an email at swiggysocial@swiggy.in, so we can help resolve the issue.",2025-07-26 16:32:39,4.84.2
bb42a576-0da3-45b2-8ad4-ee2bf9698870,Chanpreet Singh,https://play-lh.googleusercontent.com/a-/ALV-UjXXmfA9-7Sajc4SkxL3hs-F42lPePRY51LESfDuO1kP8gGrKVc,zero customer service and support,1,0,,2025-07-26 16:28:17,"Hi there, we sincerely apologize for this experience. Please reach out to us at swiggysocial@swiggy.in using your registered email address and provide details about your experience, so we can investigate the matter and address it for you.",2025-07-26 17:58:23,
85b7fa47-87aa-4077-9ef5-f3b914fd978f,Sonakshi Kashyap,https://play-lh.googleusercontent.com/a-/ALV-UjU-YR7ilxYWLx3mbJEuac51vS9ex1m0AOypcvvuHNT6GKRyomUf,Gd service 👍🏻,5,0,4.84.2,2025-07-26 16:27:48,Hey there! It's a bliss to see that our service brought a smile to your face. We'll endeavor to keep it up. Keep Swiggying. 🙂,2025-07-26 16:32:40,4.84.2
9876363f-57fe-4221-bcb9-e30227cd4da7,Virender Kumar,https://play-lh.googleusercontent.com/a-/ALV-UjXXtAzU5GcDF_jVyGzwfMi0lDof0ETHMMB-H1vUG5GO4P2rjGGV,nice order fast,5,0,4.84.2,2025-07-26 16:26:46,"Hi there, we appreciate your outstanding rating. This motivates us to keep providing exceptional service, as we consistently strive to do.",2025-07-26 18:09:54,4.84.2
8fad3dba-b6ac-425c-8f87-4ee325509b7f,Arpit Verma,https://play-lh.googleusercontent.com/a/ACg8ocIIPgr6O4ydLkyFGQxkdxCHpDt_SA9Dck__BVdPyC6zusnCSA=mo,fast delivery 🚚,5,0,4.84.2,2025-07-26 16:26:29,"Hi there, we appreciate your outstanding rating. This motivates us to keep providing exceptional service, as we consistently strive to do.",2025-07-26 18:09:08,4.84.2
615f20b9-f3ff-493d-b11e-d0f1becf00ce,Manan Parmar,https://play-lh.googleusercontent.com/a/ACg8ocIEQoZJQiScmrkxfz4LV8CArXp7tS7Buzp9AJb_CkXieItVHA=mo,good,5,0,4.82.1,2025-07-26 16:25:30,"Hi there, thank you for your patronage and the perfect rating. We will strive to provide consistent seamless ordering experiences. Keep Swiggying!",2025-07-26 16:32:41,4.82.1
2e6d21ee-9a05-466d-89a6-e1ca60793b4a,SUSHMA VERMA,https://play-lh.googleusercontent.com/a-/ALV-UjXSTvuSPYpFQlxatgU1D8S-RfQEiBf7wZfmAnIXFUyXVVemxN3x,gud,5,0,4.83.4,2025-07-26 16:25:05,"Hey there, nothing delights us more than hearing this. We are happy that you had a great experience. Keep Swiggying. 🙂",2025-07-26 17:59:52,4.83.4
24af56df-ead9-479b-9ef8-ea1b6281edd0,शाश्वत रस्तोगी,https://play-lh.googleusercontent.com/a-/ALV-UjWpNF4C5pY6Cq4nlzqhgqPdVWhBTidhBfkrESdBNVJMc-eHaMX9,Very Good,5,0,4.84.2,2025-07-26 16:24:11,"Hello, nothing delights us more than hearing this. We are happy that you had a great experience. Keep Swiggying. 😊",2025-07-26 16:32:38,4.84.2
442387f5-8396-4a53-912f-ec9acb3b353e,sharada todur,https://play-lh.googleusercontent.com/a/ACg8ocKhBg_5NkVGwH0bxXR_nXOz-CLQHQtELjAgYsH3SpGeneI6PQ=mo,Excellent Service,5,0,4.84.2,2025-07-26 16:21:46,We are happy to hear such positive feedback. 🙂,2025-07-26 16:22:36,4.84.2
e953a70d-14b4-481b-8cfa-97d93dcf7f7b,Shiekh mohammed,https://play-lh.googleusercontent.com/a/ACg8ocJh-KPSL-AD70IV7RrXWexrcR9H_KHgOha5Sm63d7wBVYO0bw=mo,👍 good,5,0,4.84.2,2025-07-26 16:20:53,Hey there! It's a bliss to see that our service brought a smile to your face. We'll endeavor to keep it up. Keep Swiggying. 🙂,2025-07-26 16:22:37,4.84.2
991d0ed3-b8c9-401f-b04a-e4e5e8830771,Chetram Meena,https://play-lh.googleusercontent.com/a-/ALV-UjUpRFJn6k0x8kVIzEOq6eVwUzJakC_JbeBARf8uPtY1qrUoCGq5,ok,5,0,,2025-07-26 16:20:51,"Hey there, thank you for the valuable feedback. We request you to let us know more about your experience by writing an email to swiggysocial@swiggy.in so we can make our services better.",2025-07-26 16:22:35,
36121788-d3cf-4103-b905-1c4a2b31ab0e,Thanisha M,https://play-lh.googleusercontent.com/a-/ALV-UjWx1vuOEsYh8S6WTKduIYeKvOFNLba12wxgaSg6gMY5BTPHv71E,super,5,0,4.84.2,2025-07-26 16:20:19,"Hey, we are glad to have patrons like you and will strive towards providing better services to keep such reviews coming our way. Keep ordering.",2025-07-26 16:22:37,4.84.2
c9a262fc-f760-4563-b0e1-078cc8f6f393,Santhosh Shetty,https://play-lh.googleusercontent.com/a-/ALV-UjXu-f493zU77RVjpkafpBRhyWaF-3W4g2jtshRdpoS97koLFwLs,got a good discount on my food order today !!! 👍,5,0,4.84.2,2025-07-26 16:18:15,"Hi there, thank you for your patronage and the perfect rating. We will strive to provide consistent seamless ordering experiences. Keep Swiggying!",2025-07-26 16:22:35,4.84.2
23bc2046-16c3-43bd-b5e1-34bafff78d5a,Sandeep,https://play-lh.googleusercontent.com/a-/ALV-UjVP8wS9CCg4wOT7GRbvMaawQLrjLyBTBefG37ILctodTxtaWLA,late deleviry,1,0,4.84.2,2025-07-26 16:16:47,"Hey, we request you to let us know more about your experience by writing us an email at swiggysocial@swiggy.in from your registered email ID so that we can have your concern addressed.",2025-07-26 16:22:36,4.84.2
1d12763c-0f00-4aa1-aca0-fff659456bf6,Sanjay Rajput,https://play-lh.googleusercontent.com/a-/ALV-UjVjgPi4SNooupqME57zLCGUVRT2CyEviGh2FL3vQ1cLEppbsEFA,so good 👍👍,5,0,4.81.1,2025-07-26 16:13:59,"Hello, nothing delights us more than hearing this. We are happy that you had a great experience. Keep Swiggying. 😊",2025-07-26 16:22:36,4.81.1
9b66af8f-ed04-459d-aac4-9a9bbff57822,Siddu Kani,https://play-lh.googleusercontent.com/a/ACg8ocLel-mTjnL4dhSVPkGJo-JXuzkHaKSqb0OzaypvclD156uA-Q=mo,thank you swiggy,5,0,4.84.2,2025-07-26 16:13:52,"Hey, thanks for the rating! This motivates us to keep serving you better with every order.",2025-07-26 16:22:36,4.84.2
e2d34097-988b-4bb3-afaa-71231b343915,Vishnu Kumar,https://play-lh.googleusercontent.com/a/ACg8ocLfKY66y0rqBXfETFxlNEjoE91u2nKBvXuC_4sBhNRLRZC51Q=mo,khane me kuchh aur dikhne me kuchh aur waah bhai Swiggy teri lila apram parr hai 🙏🙂,5,0,4.84.2,2025-07-26 16:13:12,"Hey, thank you for your kind review. We hope to keep on giving you a consistent service every time. We request you to let us know more about your experience by writing an email to swiggysocial@swiggy.in so we can make our services better.",2025-07-26 16:22:37,4.84.2
edb60080-de67-4622-b763-ea274560dc08,Shyam R Arikilla,https://play-lh.googleusercontent.com/a-/ALV-UjX6WjfI34Y9rZEooA1896zO0MW-xplKi0NJE-A0SzNdgZzVT7c,good,5,0,4.84.2,2025-07-26 16:06:57,Hey there! It's a bliss to see that our service brought a smile to your face. We'll endeavor to keep it up. Keep Swiggying. 🙂,2025-07-26 16:12:34,4.84.2
243f41ca-3df8-4294-a3c2-65bbc1aa8641,Abdul Bari,https://play-lh.googleusercontent.com/a/ACg8ocJk2EAAlEO1uDh65xLTuot3E95kgiw3Hh31jFgZVL2nHBIrIg=mo,nice 👍,5,0,4.83.2,2025-07-26 16:03:52,"Hi there, we appreciate your outstanding rating. This motivates us to keep providing exceptional service, as we consistently strive to do.",2025-07-26 16:49:56,4.83.2
3b05eb0a-8c04-4504-a51a-0dcb33ad9900,Sejal Gupta,https://play-lh.googleusercontent.com/a/ACg8ocI9596pPFVXpBG5DQILJuPMF29CIFx2KSZ0e2MjnFpvhO4_3A=mo,good,5,0,4.84.2,2025-07-26 16:02:16,"Hey there, nothing delights us more than hearing this. We are happy that you had a great experience. Keep Swiggying. 🙂",2025-07-26 16:02:32,4.84.2
5378fc34-84bf-4e8c-ba7e-7688f27d7806,Dinesh Singh munda,https://play-lh.googleusercontent.com/a/ACg8ocJbqDcKhRjQqPZBP-G6n4qydNzzBibxO7TXvF7F-EB9c7M2Mg=mo,because you taking very much money 🤑 of tip,2,0,4.84.2,2025-07-26 16:01:54,"We are sorry to let you down. Please write to us at swiggysocial@swiggy.in from your registered email address elaborating further on your ordeal, so we can expiate for the miss.",2025-07-26 16:02:31,4.84.2
ca3d666b-ab6f-4249-9074-e255cfab6a5b,Manish Chandravanshi,https://play-lh.googleusercontent.com/a/ACg8ocISOKBqPh6WPojsyzgcpW29CgIWe6rpJ3nbfzzHSYRIpYLU8A=mo,This is my first time in Swiggy let me know,3,0,,2025-07-26 15:56:50,"Hey there, we are thankful to you for your review! We request you to let us know more about your experience by writing an email to swiggysocial@swiggy.in so we can make our services better.",2025-07-26 16:02:32,
