reviewId,userName,userImage,content,score,thumbsUpCount,reviewCreatedVersion,at,replyContent,repliedAt,appVersion
0202d70c-212c-4497-bbee-60181cd2b932,A Google user,https://play-lh.googleusercontent.com/EGemoI2NTXmTsBVtJqk8jxF9rh8ApRWfsIMQSt2uE4OcpQqbFu7f7NbTK05lx80nuSijCz7sc3a277R67g,very good,5,0,4.84.0,2025-07-27 00:20:04,"Hi there, thank you for your patronage and the perfect rating. We will strive to provide consistent seamless ordering experiences. Keep Swiggying!",2025-07-27 00:22:33,4.84.0
3a08a785-6c33-4526-b508-adc8bf335b4d,A Google user,https://play-lh.googleusercontent.com/EGemoI2NTXmTsBVtJqk8jxF9rh8ApRWfsIMQSt2uE4OcpQqbFu7f7NbTK05lx80nuSijCz7sc3a277R67g,good,5,0,4.84.2,2025-07-27 00:19:20,Hey there! Such positive reviews motivate us to strive hard to provide you a much better experience. Happy ordering. 🙂,2025-07-27 00:22:33,4.84.2
125bb9bd-b804-4ac2-a608-a4a839d0180f,A Google user,https://play-lh.googleusercontent.com/EGemoI2NTXmTsBVtJqk8jxF9rh8ApRWfsIMQSt2uE4OcpQqbFu7f7NbTK05lx80nuSijCz7sc3a277R67g,good,5,0,4.84.2,2025-07-27 00:15:16,"Hi there, thank you for your patronage and the perfect rating. We will strive to provide consistent seamless ordering experiences. Keep Swiggying!",2025-07-27 00:22:34,4.84.2
73d04a37-3680-48b9-8818-db94d8077cc3,A Google user,https://play-lh.googleusercontent.com/EGemoI2NTXmTsBVtJqk8jxF9rh8ApRWfsIMQSt2uE4OcpQqbFu7f7NbTK05lx80nuSijCz7sc3a277R67g,Dilvery is slow,1,0,4.84.2,2025-07-27 00:12:24,"Hi there, we are sorry for any hassle you have faced while ordering with us. Please share the order ID along with the details of the issue by writing to us at swiggysocial@swiggy.in from your registered email address and we would be happy to connect with you and resolve the matter.",2025-07-27 00:22:34,4.84.2
ffdd1a07-d716-4b47-aecc-d41869dbb8f0,A Google user,https://play-lh.googleusercontent.com/EGemoI2NTXmTsBVtJqk8jxF9rh8ApRWfsIMQSt2uE4OcpQqbFu7f7NbTK05lx80nuSijCz7sc3a277R67g,"all products available in one store , reasonable prices",5,0,4.84.2,2025-07-27 00:11:31,Hey there! Such positive reviews motivate us to strive hard to provide you a much better experience. Happy ordering. 🙂,2025-07-27 00:12:31,4.84.2
f60f2092-f735-484e-9206-92a154325461,A Google user,https://play-lh.googleusercontent.com/EGemoI2NTXmTsBVtJqk8jxF9rh8ApRWfsIMQSt2uE4OcpQqbFu7f7NbTK05lx80nuSijCz7sc3a277R67g,good,5,0,4.84.2,2025-07-27 00:07:45,Hey there! It's a bliss to see that our service brought a smile to your face. We'll endeavor to keep it up. Keep Swiggying. 🙂,2025-07-27 00:12:32,4.84.2
ef4ea8c8-e3d2-41e2-aa6f-759b50a80561,A Google user,https://play-lh.googleusercontent.com/EGemoI2NTXmTsBVtJqk8jxF9rh8ApRWfsIMQSt2uE4OcpQqbFu7f7NbTK05lx80nuSijCz7sc3a277R67g,ok sir,5,0,4.84.2,2025-07-27 00:07:45,"Hey, thank you for your kind review. We hope to keep on giving you a consistent service every time. We request you to let us know more about your experience by writing an email to swiggysocial@swiggy.in so we can make our services better.",2025-07-27 00:12:32,4.84.2
50e5e85b-aa38-45fa-87b3-15955321f5c8,A Google user,https://play-lh.googleusercontent.com/EGemoI2NTXmTsBVtJqk8jxF9rh8ApRWfsIMQSt2uE4OcpQqbFu7f7NbTK05lx80nuSijCz7sc3a277R67g,very good service,4,0,4.84.2,2025-07-26 23:59:44,"Hi there, thank you for the review and the stars. We would love to hear from you about how we could hit the 5-star rating. Please do share your thoughts by dropping an email from your registered address at swiggysocial@swiggy.in. Looking forward to hearing from you. Keep Swiggying till then 😊",2025-07-27 00:02:27,4.84.2
258378d9-45c4-4eb1-8a52-b3bd07c860e1,A Google user,https://play-lh.googleusercontent.com/EGemoI2NTXmTsBVtJqk8jxF9rh8ApRWfsIMQSt2uE4OcpQqbFu7f7NbTK05lx80nuSijCz7sc3a277R67g,best,5,0,4.84.2,2025-07-26 23:55:25,Hey there! It's a bliss to see that our service brought a smile to your face. We'll endeavor to keep it up. Keep Swiggying. 🙂,2025-07-27 00:02:27,4.84.2
a3e52e89-43e9-4241-80e4-bcc34bf8d498,A Google user,https://play-lh.googleusercontent.com/EGemoI2NTXmTsBVtJqk8jxF9rh8ApRWfsIMQSt2uE4OcpQqbFu7f7NbTK05lx80nuSijCz7sc3a277R67g,nic,5,0,4.84.2,2025-07-26 23:53:27,"Hey, thank you for your feedback. We request you to let us know more about your experience by writing an email to swiggysocial@swiggy.in so we can make our services better.",2025-07-27 00:02:27,4.84.2
c87070c1-6079-4de3-ab6a-7ecd72d60b50,A Google user,https://play-lh.googleusercontent.com/EGemoI2NTXmTsBVtJqk8jxF9rh8ApRWfsIMQSt2uE4OcpQqbFu7f7NbTK05lx80nuSijCz7sc3a277R67g,Fake offers on Instamart with no customer support,1,0,4.79.2,2025-07-26 23:51:30,"Hello, we're sorry for the unpleasant experience. Please share your concern along with your order details via email at swiggysocial@swiggy.in so that we will look into this & assist you better.",2025-07-26 23:52:25,4.79.2
6aa53e5c-e6e1-4e13-bac7-682089c5f7ac,A Google user,https://play-lh.googleusercontent.com/EGemoI2NTXmTsBVtJqk8jxF9rh8ApRWfsIMQSt2uE4OcpQqbFu7f7NbTK05lx80nuSijCz7sc3a277R67g,One hour for delivery within 1 kilometre. No refunds or any apologies.,1,0,4.84.2,2025-07-26 23:50:40,"We sincerely apologize for this experience. Please reach out to us at swiggysocial@swiggy.in using your registered email address and provide details about your experience, so we can investigate the matter and address it for you.",2025-07-27 01:51:26,4.84.2
59114337-13aa-4f6b-98d3-712722997e89,A Google user,https://play-lh.googleusercontent.com/EGemoI2NTXmTsBVtJqk8jxF9rh8ApRWfsIMQSt2uE4OcpQqbFu7f7NbTK05lx80nuSijCz7sc3a277R67g,nice,5,0,4.84.2,2025-07-26 23:43:50,"Hey, thanks for the rating! This motivates us to keep serving you better with every order.",2025-07-26 23:52:25,4.84.2
3287ec03-102a-4460-8883-9b995906c6c2,A Google user,https://play-lh.googleusercontent.com/EGemoI2NTXmTsBVtJqk8jxF9rh8ApRWfsIMQSt2uE4OcpQqbFu7f7NbTK05lx80nuSijCz7sc3a277R67g,giving 1 rupees free delivery coupon but by increasing gst and restaurant fee charges at max doesn't deserve star,2,0,4.84.2,2025-07-26 23:42:16,,,4.84.2
2d2833ad-7624-44fc-b17e-741f48676278,A Google user,https://play-lh.googleusercontent.com/EGemoI2NTXmTsBVtJqk8jxF9rh8ApRWfsIMQSt2uE4OcpQqbFu7f7NbTK05lx80nuSijCz7sc3a277R67g,good,5,0,4.84.2,2025-07-26 23:42:11,"Hey, we are glad to have patrons like you and will strive towards providing better services to keep such reviews coming our way. Keep ordering.",2025-07-26 23:42:33,4.84.2
8733ce67-01c5-42c4-8837-92174ca6b1ee,A Google user,https://play-lh.googleusercontent.com/EGemoI2NTXmTsBVtJqk8jxF9rh8ApRWfsIMQSt2uE4OcpQqbFu7f7NbTK05lx80nuSijCz7sc3a277R67g,customer service is terrible.... and taxes are so much.,2,0,4.84.2,2025-07-26 23:41:59,"Hi, please let us know how we can make our service better by writing to us at swiggysocial@swiggy.in from your registered email address.",2025-07-26 23:42:34,4.84.2
f324b2ef-5b23-4a58-b080-a57de1ca2c25,A Google user,https://play-lh.googleusercontent.com/EGemoI2NTXmTsBVtJqk8jxF9rh8ApRWfsIMQSt2uE4OcpQqbFu7f7NbTK05lx80nuSijCz7sc3a277R67g,too good,5,0,4.84.2,2025-07-26 23:41:34,Yay! We are super happy to know that you are enjoying our services. Thanks for taking the time out and sharing the review with a perfect star rating. Keep Ordering. 🙂,2025-07-26 23:42:33,4.84.2
3df1e529-730f-45cb-b9d3-bbc780f4529c,A Google user,https://play-lh.googleusercontent.com/EGemoI2NTXmTsBVtJqk8jxF9rh8ApRWfsIMQSt2uE4OcpQqbFu7f7NbTK05lx80nuSijCz7sc3a277R67g,super,5,0,4.85.1,2025-07-26 23:39:48,"Hey there, thank you for the perfect ratings. We appreciate your efforts in contributing to our improvements.",2025-07-26 23:42:33,4.85.1
2e51336d-c540-4e16-bcd3-ee1b864e092a,A Google user,https://play-lh.googleusercontent.com/EGemoI2NTXmTsBVtJqk8jxF9rh8ApRWfsIMQSt2uE4OcpQqbFu7f7NbTK05lx80nuSijCz7sc3a277R67g,good,5,0,4.83.4,2025-07-26 23:39:40,"Hey, we are glad to have patrons like you and will strive towards providing better services to keep such reviews coming our way. Keep ordering.",2025-07-26 23:42:34,4.83.4
ce4e8289-c4ca-4c99-83e4-04e65722fa0f,A Google user,https://play-lh.googleusercontent.com/EGemoI2NTXmTsBVtJqk8jxF9rh8ApRWfsIMQSt2uE4OcpQqbFu7f7NbTK05lx80nuSijCz7sc3a277R67g,good,4,0,4.84.2,2025-07-26 23:38:20,"Hi there, thank you for the review and the stars. We would love to hear from you about how we could hit the 5-star rating. Please do share your thoughts by dropping an email from your registered address at swiggysocial@swiggy.in. Looking forward to hearing from you. Keep Swiggying till then. 😊",2025-07-26 23:42:34,4.84.2
a72121b9-58f2-4ced-85a0-73c632b19e44,A Google user,https://play-lh.googleusercontent.com/EGemoI2NTXmTsBVtJqk8jxF9rh8ApRWfsIMQSt2uE4OcpQqbFu7f7NbTK05lx80nuSijCz7sc3a277R67g,five star,4,0,4.84.2,2025-07-26 23:37:02,"Hey there, we are thankful to you for your review! We request you to let us know more about your experience by writing an email to swiggysocial@swiggy.in so we can make our services better.",2025-07-26 23:42:35,4.84.2
e33a8b7e-3a54-4dc5-9b2d-9b59d912ee87,A Google user,https://play-lh.googleusercontent.com/EGemoI2NTXmTsBVtJqk8jxF9rh8ApRWfsIMQSt2uE4OcpQqbFu7f7NbTK05lx80nuSijCz7sc3a277R67g,good,5,0,4.84.2,2025-07-26 23:35:01,"Hi there, thank you for the excellent rating. This will inspire us to continue delivering exceptional service as we always do.",2025-07-27 01:21:15,4.84.2
122d5924-88f6-4332-896e-d446f564752e,A Google user,https://play-lh.googleusercontent.com/EGemoI2NTXmTsBVtJqk8jxF9rh8ApRWfsIMQSt2uE4OcpQqbFu7f7NbTK05lx80nuSijCz7sc3a277R67g,price of the products are high,2,0,4.83.4,2025-07-26 23:29:26,"Hey there, we apologize for the inconvenience caused. We request you to kindly let us know more about the issue by writing to us at swiggysocial@swiggy.in from your registered email address, so we can look into it and have it fixed at the earliest.",2025-07-26 23:32:33,4.83.4
1c5b173b-7c3e-48ea-bf31-6ac1d42cd3b6,A Google user,https://play-lh.googleusercontent.com/EGemoI2NTXmTsBVtJqk8jxF9rh8ApRWfsIMQSt2uE4OcpQqbFu7f7NbTK05lx80nuSijCz7sc3a277R67g,your performance is very better and timely recieve,5,0,4.84.2,2025-07-26 23:28:52,"Hey there, thank you for the perfect ratings. We appreciate your efforts in contributing to our improvements.",2025-07-26 23:32:32,4.84.2
f3c8c89c-ba9a-403a-b109-37729dd56c09,A Google user,https://play-lh.googleusercontent.com/EGemoI2NTXmTsBVtJqk8jxF9rh8ApRWfsIMQSt2uE4OcpQqbFu7f7NbTK05lx80nuSijCz7sc3a277R67g,No good support team.. No proper resolution after getting tiffins delivered without chutney.,1,0,4.84.2,2025-07-26 23:25:40,"Hi, we are sorry about this. Please help us with the order id over an email at swiggysocial@swiggy.in, so we can help resolve the issue.",2025-07-26 23:32:34,4.84.2
636e4e0a-17ad-4604-9b29-1e58eea86096,A Google user,https://play-lh.googleusercontent.com/EGemoI2NTXmTsBVtJqk8jxF9rh8ApRWfsIMQSt2uE4OcpQqbFu7f7NbTK05lx80nuSijCz7sc3a277R67g,price's High,1,0,4.85.1,2025-07-26 23:21:21,"Hi, please write to us about your experience at swiggysocial@swiggy.in from your registered email address, so we can better our services.",2025-07-26 23:22:30,4.85.1
49ba2fa7-5010-48d9-873d-a66d2c00afa7,A Google user,https://play-lh.googleusercontent.com/EGemoI2NTXmTsBVtJqk8jxF9rh8ApRWfsIMQSt2uE4OcpQqbFu7f7NbTK05lx80nuSijCz7sc3a277R67g,good,5,0,4.84.1,2025-07-26 23:21:15,"Hey, we are glad to have patrons like you and will strive towards providing better services to keep such reviews coming our way. Keep ordering.",2025-07-26 23:22:30,4.84.1
0650cac2-856c-49c3-af89-27a2cc1bd138,A Google user,https://play-lh.googleusercontent.com/EGemoI2NTXmTsBVtJqk8jxF9rh8ApRWfsIMQSt2uE4OcpQqbFu7f7NbTK05lx80nuSijCz7sc3a277R67g,Thora bachdi krta hai but karta 5 mints ke jgha 45 lagta hai but karta hai,5,0,4.84.2,2025-07-26 23:20:41,"Hey there, we are thankful to you for your review! We request you to let us know more about your experience by writing an email to swiggysocial@swiggy.in so we can make our services better.",2025-07-26 23:22:30,4.84.2
548a9496-8d63-4375-bc27-b18646f1987f,A Google user,https://play-lh.googleusercontent.com/EGemoI2NTXmTsBVtJqk8jxF9rh8ApRWfsIMQSt2uE4OcpQqbFu7f7NbTK05lx80nuSijCz7sc3a277R67g,now a days multiple orders are assigned to delivery agent and that is the delivery time significantly long that is very discouraging,1,0,4.84.2,2025-07-26 23:18:00,"Hey, thank you for the ratings. We request you to let us know more about your experience by writing an email to swiggysocial@swiggy.in, so we can make our services better.",2025-07-27 00:02:33,4.84.2
0dfab4e0-375e-4b98-8123-6f3f4d98d2d6,A Google user,https://play-lh.googleusercontent.com/EGemoI2NTXmTsBVtJqk8jxF9rh8ApRWfsIMQSt2uE4OcpQqbFu7f7NbTK05lx80nuSijCz7sc3a277R67g,i ordered a burger and fries at 4 am and it came at 6 am so i didnt take the order and then they add cancellation fee to my next order. what do they expect ? wait for 2 hours for my order ?,1,0,4.84.2,2025-07-26 23:13:30,"We sincerely apologize for this experience. Please reach out to us at swiggysocial@swiggy.in using your registered email address and provide details about your experience, so we can investigate the matter and address it for you.",2025-07-27 01:56:57,4.84.2
bdd29ff7-2ec0-4c73-9926-73e0c8f3af87,A Google user,https://play-lh.googleusercontent.com/EGemoI2NTXmTsBVtJqk8jxF9rh8ApRWfsIMQSt2uE4OcpQqbFu7f7NbTK05lx80nuSijCz7sc3a277R67g,charges are very high compared to blinkit,3,0,4.82.1,2025-07-26 23:13:19,"Hi, sorry to know this. We would like to know more about your concern. Please write to swiggysocial@swiggy.in regarding the same and we'll work on fixing the issue ASAP.",2025-07-26 23:22:31,4.82.1
a71cfe7e-8312-4aa0-a317-2f863c048b72,A Google user,https://play-lh.googleusercontent.com/EGemoI2NTXmTsBVtJqk8jxF9rh8ApRWfsIMQSt2uE4OcpQqbFu7f7NbTK05lx80nuSijCz7sc3a277R67g,good,5,0,4.84.2,2025-07-26 23:12:20,Hey there! Such positive reviews motivate us to strive hard to provide you a much better experience. Happy ordering. 🙂,2025-07-26 23:22:29,4.84.2
b4d3734e-58b7-45a4-90f2-60154046fb06,A Google user,https://play-lh.googleusercontent.com/EGemoI2NTXmTsBVtJqk8jxF9rh8ApRWfsIMQSt2uE4OcpQqbFu7f7NbTK05lx80nuSijCz7sc3a277R67g,I ordered from Swiggy and cancelled the order within 1 minute but they did not refund. There are many people who have had similar experiences. I hope this does not happen to you...... ☆0/5,1,0,4.84.2,2025-07-26 23:10:35,"Hey there, we apologize for the inconvenience caused. We request you to kindly let us know more about the issue by writing to us at swiggysocial@swiggy.in from your registered email address, so we can look into it and have it fixed at the earliest.",2025-07-26 23:12:28,4.84.2
4657d10e-0ee0-4bc8-aca5-2c2178080794,A Google user,https://play-lh.googleusercontent.com/EGemoI2NTXmTsBVtJqk8jxF9rh8ApRWfsIMQSt2uE4OcpQqbFu7f7NbTK05lx80nuSijCz7sc3a277R67g,good,3,0,4.84.2,2025-07-26 23:08:59,"Hey there, thank you for the valuable feedback. We request you to let us know more about your experience by writing an email to swiggysocial@swiggy.in so we can make our services better.",2025-07-26 23:12:27,4.84.2
fa1e12c4-199b-4430-ba8b-9e4552aba64b,A Google user,https://play-lh.googleusercontent.com/EGemoI2NTXmTsBVtJqk8jxF9rh8ApRWfsIMQSt2uE4OcpQqbFu7f7NbTK05lx80nuSijCz7sc3a277R67g,I ordered from Swiggy and cancelled the order within 1 minute but they did not refund. There are many people who have had similar experiences. I hope this does not happen to you......,1,0,4.79.2,2025-07-26 23:03:46,"Hello, we're sorry for the unpleasant experience. Please share your concern along with your order details via email at swiggysocial@swiggy.in so that we will look into this & assist you better.",2025-07-26 23:12:28,4.79.2
8002e906-ea8b-457c-b3e0-1b23c2f9afcb,A Google user,https://play-lh.googleusercontent.com/EGemoI2NTXmTsBVtJqk8jxF9rh8ApRWfsIMQSt2uE4OcpQqbFu7f7NbTK05lx80nuSijCz7sc3a277R67g,good job 👏👍,5,0,4.84.2,2025-07-26 23:01:57,Hey there! It's a bliss to see that our service brought a smile to your face. We'll endeavor to keep it up. Keep Swiggying. 🙂,2025-07-26 23:02:41,4.84.2
462fbb8c-2d7a-4ba9-a809-93d71720451f,A Google user,https://play-lh.googleusercontent.com/EGemoI2NTXmTsBVtJqk8jxF9rh8ApRWfsIMQSt2uE4OcpQqbFu7f7NbTK05lx80nuSijCz7sc3a277R67g,nice,3,0,4.84.2,2025-07-26 23:01:40,"Hi there, thank you for the rating. We sincerely apologize for this experience. Please reach out to us at swiggysocial@swiggy.in using your registered email address and provide details about your experience, so we can investigate the matter and address it for you.",2025-07-27 01:27:17,4.84.2
6b529521-61a1-4aba-ae13-ed03a910857c,A Google user,https://play-lh.googleusercontent.com/EGemoI2NTXmTsBVtJqk8jxF9rh8ApRWfsIMQSt2uE4OcpQqbFu7f7NbTK05lx80nuSijCz7sc3a277R67g,nice app,4,0,4.83.4,2025-07-26 23:01:14,"Hey, thanks for the rating! This motivates us to keep serving you better with every order. We would love to hear from you about how we could hit the 5-star rating. Please do share your thoughts by dropping an email at swiggysocial@swiggy.in.",2025-07-26 23:02:45,4.83.4
a0ee1fcc-fb84-4399-96ae-accfbde28690,A Google user,https://play-lh.googleusercontent.com/EGemoI2NTXmTsBVtJqk8jxF9rh8ApRWfsIMQSt2uE4OcpQqbFu7f7NbTK05lx80nuSijCz7sc3a277R67g,"Bohot hi jyada paisa mangta hai swiggy, Bohot hi ghatiya app hai isse accha to ZOMATO hai",1,0,,2025-07-26 23:00:38,"Hi, please write to us about your experience at swiggysocial@swiggy.in from your registered email address, so we can better our services.",2025-07-26 23:02:41,
d27e00c3-33aa-471c-81ff-89dc16af2fff,A Google user,https://play-lh.googleusercontent.com/EGemoI2NTXmTsBVtJqk8jxF9rh8ApRWfsIMQSt2uE4OcpQqbFu7f7NbTK05lx80nuSijCz7sc3a277R67g,"kittogiro dabba app,worst app ,I just uninstall this app",1,0,,2025-07-26 23:00:29,"We are sorry to let you down. Please write to us at swiggysocial@swiggy.in from your registered email address elaborating further on your ordeal, so we can expiate for the miss.",2025-07-26 23:02:43,
796c7fef-dce3-4a12-abdd-feb535da7d47,A Google user,https://play-lh.googleusercontent.com/EGemoI2NTXmTsBVtJqk8jxF9rh8ApRWfsIMQSt2uE4OcpQqbFu7f7NbTK05lx80nuSijCz7sc3a277R67g,"worst app, worst customer service, i got raised a dispute and the customer care is ignoring all my mails and closing all raised tickets in app without any solutions",1,0,4.84.2,2025-07-26 23:00:08,"Hi, we are sorry about this. Please help us with the order id over an email at swiggysocial@swiggy.in, so we can help resolve the issue.",2025-07-26 23:02:43,4.84.2
8a5f745a-6a64-40bc-8b18-6cc391829b29,A Google user,https://play-lh.googleusercontent.com/EGemoI2NTXmTsBVtJqk8jxF9rh8ApRWfsIMQSt2uE4OcpQqbFu7f7NbTK05lx80nuSijCz7sc3a277R67g,fast delivery,5,0,,2025-07-26 22:58:47,We are happy to hear such positive feedback. 🙂,2025-07-26 23:02:44,
e7fe7b27-c710-4a8d-8e6f-e1d49de3e88d,A Google user,https://play-lh.googleusercontent.com/EGemoI2NTXmTsBVtJqk8jxF9rh8ApRWfsIMQSt2uE4OcpQqbFu7f7NbTK05lx80nuSijCz7sc3a277R67g,good experience,5,0,4.84.2,2025-07-26 22:58:21,Hey there! Such positive reviews motivate us to strive hard to provide you a much better experience. Happy ordering. 🙂,2025-07-26 23:02:44,4.84.2
34da1965-ac97-48b9-985d-763750727663,A Google user,https://play-lh.googleusercontent.com/EGemoI2NTXmTsBVtJqk8jxF9rh8ApRWfsIMQSt2uE4OcpQqbFu7f7NbTK05lx80nuSijCz7sc3a277R67g,Excellent,5,0,,2025-07-26 22:57:25,"Hi there, thank you for your patronage and the perfect rating. We will strive to provide consistent seamless ordering experiences. Keep Swiggying!",2025-07-26 23:02:42,
8e2bc300-9f1d-405f-95f2-b0a449d373f5,A Google user,https://play-lh.googleusercontent.com/EGemoI2NTXmTsBVtJqk8jxF9rh8ApRWfsIMQSt2uE4OcpQqbFu7f7NbTK05lx80nuSijCz7sc3a277R67g,best food delivery app,5,0,4.84.2,2025-07-26 22:57:24,Hey there! Such positive reviews motivate us to strive hard to provide you a much better experience. Happy ordering. 🙂,2025-07-26 23:02:42,4.84.2
1b6aba1e-528b-4a6b-b5f3-8fcc9aae6cdb,A Google user,https://play-lh.googleusercontent.com/EGemoI2NTXmTsBVtJqk8jxF9rh8ApRWfsIMQSt2uE4OcpQqbFu7f7NbTK05lx80nuSijCz7sc3a277R67g,👍,5,0,4.84.2,2025-07-26 22:56:50,"Hey there, thank you for the perfect ratings. We appreciate your efforts in contributing to our improvements.",2025-07-26 23:02:44,4.84.2
bb27267b-a0f1-4d54-8719-34ea0640c2f5,A Google user,https://play-lh.googleusercontent.com/EGemoI2NTXmTsBVtJqk8jxF9rh8ApRWfsIMQSt2uE4OcpQqbFu7f7NbTK05lx80nuSijCz7sc3a277R67g,irresponsible. bad management. mismanaged deliveries,1,0,4.84.2,2025-07-26 22:55:58,"Hi, we are sorry about this. Please help us with the order id over an email at swiggysocial@swiggy.in, so we can help resolve the issue.",2025-07-26 23:02:42,4.84.2
9e902be0-ddf1-40a1-8de6-c9ba251f289a,A Google user,https://play-lh.googleusercontent.com/EGemoI2NTXmTsBVtJqk8jxF9rh8ApRWfsIMQSt2uE4OcpQqbFu7f7NbTK05lx80nuSijCz7sc3a277R67g,Tejinder kumar this is my first order,4,0,4.84.2,2025-07-26 22:55:07,"Hey there, we are thankful to you for your review! We request you to let us know more about your experience by writing an email to swiggysocial@swiggy.in so we can make our services better.",2025-07-26 23:02:43,4.84.2
6d8fff46-7257-4b59-ad2d-9024830f5d29,A Google user,https://play-lh.googleusercontent.com/EGemoI2NTXmTsBVtJqk8jxF9rh8ApRWfsIMQSt2uE4OcpQqbFu7f7NbTK05lx80nuSijCz7sc3a277R67g,awesome 😎,5,0,4.84.2,2025-07-26 22:54:25,"Hi there, thank you for your patronage and the perfect rating. We will strive to provide consistent seamless ordering experiences. Keep Swiggying!",2025-07-26 23:02:44,4.84.2
0e75af33-e68d-461a-99b0-1700439d81ae,A Google user,https://play-lh.googleusercontent.com/EGemoI2NTXmTsBVtJqk8jxF9rh8ApRWfsIMQSt2uE4OcpQqbFu7f7NbTK05lx80nuSijCz7sc3a277R67g,good fasting delivery,3,0,4.83.4,2025-07-26 22:53:27,"Hey, thank you for your feedback. We request you to let us know more about your experience by writing an email to swiggysocial@swiggy.in so we can make our services better.",2025-07-26 23:02:42,4.83.4
bfe38ad9-724b-4f8e-bdbd-5d7d91eb0edb,A Google user,https://play-lh.googleusercontent.com/EGemoI2NTXmTsBVtJqk8jxF9rh8ApRWfsIMQSt2uE4OcpQqbFu7f7NbTK05lx80nuSijCz7sc3a277R67g,I want the refer and earn policy back,1,0,4.83.4,2025-07-26 22:53:09,"Hey, we request you to let us know more about your experience by writing us an email at swiggysocial@swiggy.in from your registered email ID so that we can have your concern addressed.",2025-07-26 23:02:41,4.83.4
be9684d8-f8c0-45f2-855d-8058ece6109c,A Google user,https://play-lh.googleusercontent.com/EGemoI2NTXmTsBVtJqk8jxF9rh8ApRWfsIMQSt2uE4OcpQqbFu7f7NbTK05lx80nuSijCz7sc3a277R67g,best,4,0,4.84.0,2025-07-26 22:51:39,"Hi, thank you for delighting us with the positive review. We request you to let us know more about your experience by writing an email to swiggysocial@swiggy.in so we can make our service worth 5 stars.",2025-07-26 22:52:38,4.84.0
329063d4-5c7b-45e4-a147-13fe20254d87,A Google user,https://play-lh.googleusercontent.com/EGemoI2NTXmTsBVtJqk8jxF9rh8ApRWfsIMQSt2uE4OcpQqbFu7f7NbTK05lx80nuSijCz7sc3a277R67g,very bad experience with my recent order customer support is BOT just copy and paste no resolution given by your team i received less quantity in my last order and delivery partner know that issue but still swiggy support do not help me,1,0,4.84.2,2025-07-26 22:51:13,"Hey, we request you to let us know more about your experience by writing us an email at swiggysocial@swiggy.in from your registered email ID so that we can have your concern addressed.",2025-07-26 22:52:37,4.84.2
969432d3-7dd7-421e-8765-281ecd20a06f,A Google user,https://play-lh.googleusercontent.com/EGemoI2NTXmTsBVtJqk8jxF9rh8ApRWfsIMQSt2uE4OcpQqbFu7f7NbTK05lx80nuSijCz7sc3a277R67g,the Swiggy app sometime showing free delivery option above 99 but after ordering a food it will show around 250 cheeting,4,0,4.84.2,2025-07-26 22:50:06,"Hey there, appreciate your feedback, we give utmost priority to our user's feedback and would request you to share yours on swiggysocial@swiggy.in and we can work towards implementing them to provide better services.",2025-07-26 22:52:38,4.84.2
30a47be4-8597-4917-885c-f1c6c4d5f462,A Google user,https://play-lh.googleusercontent.com/EGemoI2NTXmTsBVtJqk8jxF9rh8ApRWfsIMQSt2uE4OcpQqbFu7f7NbTK05lx80nuSijCz7sc3a277R67g,good,5,0,4.84.2,2025-07-26 22:46:18,"Hey there, thank you for the perfect ratings. We appreciate your efforts in contributing to our improvements.",2025-07-26 22:52:38,4.84.2
d9d49adc-5f6e-4b61-9ab0-bcba63cc907a,A Google user,https://play-lh.googleusercontent.com/EGemoI2NTXmTsBVtJqk8jxF9rh8ApRWfsIMQSt2uE4OcpQqbFu7f7NbTK05lx80nuSijCz7sc3a277R67g,if we cancel the order it deducts the complete bill for the cancellation fee which is not fair not acceptable at all,1,0,4.84.2,2025-07-26 22:42:24,"Hello, we would like to know more about it. Please write to us at swiggysocial@swiggy.in with relevant details elaborating further on your ordering experience with us, so we can set this right for you.",2025-07-26 22:52:37,4.84.2
0f6332a3-09fa-4fb3-a086-31bd2820e539,A Google user,https://play-lh.googleusercontent.com/EGemoI2NTXmTsBVtJqk8jxF9rh8ApRWfsIMQSt2uE4OcpQqbFu7f7NbTK05lx80nuSijCz7sc3a277R67g,good service on time,5,0,4.84.2,2025-07-26 22:42:03,We are happy to hear such positive feedback. 🙂,2025-07-26 22:42:23,4.84.2
df9a1292-27ba-44c0-8b5f-163c75423029,A Google user,https://play-lh.googleusercontent.com/EGemoI2NTXmTsBVtJqk8jxF9rh8ApRWfsIMQSt2uE4OcpQqbFu7f7NbTK05lx80nuSijCz7sc3a277R67g,important fast delivery,5,0,4.84.2,2025-07-26 22:40:44,Hey there! It's a bliss to see that our service brought a smile to your face. We'll endeavor to keep it up. Keep Swiggying. 🙂,2025-07-26 22:42:24,4.84.2
8edbf929-bce8-475d-8cd1-4c8d4d437cce,A Google user,https://play-lh.googleusercontent.com/EGemoI2NTXmTsBVtJqk8jxF9rh8ApRWfsIMQSt2uE4OcpQqbFu7f7NbTK05lx80nuSijCz7sc3a277R67g,wow,5,0,4.84.2,2025-07-26 22:40:33,"Hey there, thank you for the perfect ratings. We appreciate your efforts in contributing to our improvements.",2025-07-26 22:42:22,4.84.2
